title,href,body
ANAC apresenta a nova regulamentação de slots em curso para setor,https://www.gov.br/anac/pt-br/noticias/2024/anac-apresenta-nova-regulamentacao-em-curso-de-slots,"Comprometida com a excelência operacional e a conformidade regulatória, a Agência Nacional de Aviação Civil (ANAC) sediou em Brasília, nos dias 20 a 22 de março, nova edição do Curso de Slots.Diferentemente dos anos anteriores, a versão atualizada do treinamento abordou as mudanças e as implicações da nova norma de slots, Resolução nº 682, de 7 de junho de 2022, marcando uma ..."
"Prefeitura participa da ""Conferência Nacional Slots Verão 2024""",https://www.manaus.am.gov.br/noticias/prefeitura/prefeitura-participa-da-conferencia-nacional-slots-verao-2024-para-o-fomento-do-turismo-local/,"A Conferência Nacional de Slots é um fórum organizado pela Agência Nacional de Aviação Civil (Anac), juntamente com os aeroportos, companhias aéreas e agência reguladora, para definir e organizar as malhas aéreas domésticas brasileiras na temporada de verão 2024. Um dos eventos de maior importância e relevância no que diz respeito ..."
slot pagando no cadastro⭐Desvendando a Magia dos Slots Pagantes: Uma ...,https://academiavirtual.inpi.gov.br/moodle/course/view.php?xzid=Explorando+a+Magia+do+Futebol+Tailandês:+A+Jornada+da+Seleção+Nacional+Rumo+à+Excelência,"A interação com os diferentes recursos e temas dos slots adiciona uma camada extra de diversão e imersão. Cada giro traz a promessa de grandes prêmios e a adrenalina de testar sua sorte. Ao explorar os slots pagantes no cadastro, os jogadores podem desfrutar de uma experiência única e envolvente, que os mantém sempre retornando para mais."
gov br desbloquear conta-pp jogo ao vivo,https://2inl.queenbrat.com/news/010d599943.html,"fonte：pp jogo ao vivo autor：slots tempo：2024-03-30 13:02:41. Como desbloquear sua conta gov.br. Com o aumento da digitalização dos serviços públicos, a plataforma gov.br tem se tornado cada vez mais importante para os cidadãos brasileiros. No entanto, pode acontecer de você ter sua conta bloqueada por algum motivo."
esporte da sorte tigrinho - servicedesk.sesp.es.gov.br,https://servicedesk.sesp.es.gov.br/?games=20240512slots-carnaval.htm,"Os slots oferecidos pela esporte da sorte tigrinho são desenvolvidos por alguns dos melhores provedores de jogos do mercado, garantindo gráficos de tirar o fôlego, trilhas sonoras envolventes e recursos inovadores. Com uma biblioteca em constante expansão, os jogadores terão uma ampla variedade de opções para escolher, desde temas ..."
alano 3 slots - theobroma.ro.gov.br,https://www.theobroma.ro.gov.br/v1/trasparencia/article/20240118/2336.html,"alano 3 slots . Embarque em uma experiência única e emocionante com os Alano 3 Slots, uma inovação revolucionária na indústria de jogos online. Neste artigo, exploraremos por que os Alano 3 Slots estão redefinindo a experiência de jogo, oferecendo aos entusiastas uma jornada inigualável repleta de emoção e diversão."
King Slots Brasil - Sua Plataforma de Jogos Brasileira de Referência!,https://www.theobroma.ro.gov.br/v1/trasparencia/article/20240115/1110.html,Passo 1:Acesse o site oficial de King Slots Brasil. Passo 2:Crie uma conta gratuita e aproveite os bônus de boas-vindas. Passo 3:Escolha seu jogo de caça-níqueis favorito na plataforma e comece a jogar imediatamente. Passo 4:Participe de promoções emocionantes e suba na leaderboard para competir com outros jogadores brasileiros.
paidbooks - prodemge.gov.br,https://wwws.prodemge.gov.br/instalador-prodemge/15-suporte?download=20240513slots-rei-jogos-de-cassino.htm,"A popular plataforma de apostas online, paidbooks, acaba de lançar uma novidade emocionante: a introdução de uma vasta seleção de slots online. Com essa nova adição, os jogadores terão acesso a uma experiência de jogo inigualável, repleta de benefícios exclusivos. Os slots oferecidos pela paidbooks são desenvolvidos por alguns dos ..."
ANAC promove Conferência Nacional de Slots 2024,https://www.gov.br/anac/pt-br/noticias/2024/anac-promove-conferencia-nacional-de-slots-2024,"A Agência Nacional de Aviação Civil (ANAC) promove duas vezes ao ano a Conferência Nacional de Slots, que tem como objetivo o uso mais eficiente da infraestrutura aeroportuária brasileira. A conferência ocorreu entre os dias 17 e 19 de janeiro, em Manaus (AM), reunindo empresas aéreas domésticas e estrangeiras e aeroportos para definir ..."
slots zone casino - telemacoborba.pr.gov.br,http://www.telemacoborba.pr.gov.br/servicos/portal-do-cidadao/iptu-legislacao/lei-iptu/135-servicos/portal-do-cidadao/iptu-legislacao.html?patt=onlinefix-07-04-2024.html,"slots zone casino é a marca líder de apostas e entretenimento online no mercado brasileiro. Jogos eletrônicos, apostas em e-sports e entretenimento ao vivo em pessoa real (bacará, roleta) é profundamente amada por todos os tipos de fãs de jogos online. Ela contribui para o jogo emocionante Uma dose extra de entretenimento emocionante..."
Baixe Slots Gol no PC com MEmu,https://www.memuplay.com/pt/how-to-play-com.minpgame.slotsgol-on-pc.html,"Características do Slots Gol no PC. Com toda a sua paixão por jogar Slots Gol, não deixe os polegares te atrapalharem em uma pequena tela do seu celular. Jogue como um profissional e tenha controle total do seu jogo com teclado e mouse. O MEmu oferece todas as coisas que você está esperando. Baixe e jogue Slots Gol no PC."
new slots uk - telemacoborba.pr.gov.br,http://www.telemacoborba.pr.gov.br/servicos/portal-do-cidadao/iptu-legislacao/lei-iptu/135-servicos/portal-do-cidadao/iptu-legislacao.html?app=jogo-do-city-hoje-15-04-2024.html,"new slots uk. new slots uk é a marca líder de apostas e entretenimento online no mercado brasileiro. Jogos eletrônicos, apostas em e-sports e entretenimento ao vivo em pessoa real (bacará, roleta) é profundamente amada por todos os tipos de fãs de jogos online. Ela contribui para o jogo emocionante Uma dose extra de entretenimento ..."
Baixe Casino Slots - JACKPOT Slots no PC com MEmu,https://www.memuplay.com/pt/how-to-play-com.joker.brslots-on-pc.html,"Faça o download do instalador do MEmu e conclua a instalação. 2. Inicie o MEmu e depois abra o Google Play na página inicial. 3. Pesquise Casino Slots - JACKPOT Slots no Google Play. 4. Baixe e Instale Casino Slots - JACKPOT Slots. 5. Na conclusão da instalação, clique no ícone para iniciar."
slots br - bombeiros.pa.gov.br,https://www.bombeiros.pa.gov.br/blank=202405237bet.htm,"slots br oferece benefícios exclusivos para jogadores online. A popular plataforma de apostas online, slots br, acaba de lançar uma novidade emocionante: a introdução de uma vasta seleção de slots online. Com essa nova adição, os jogadores terão acesso a uma experiência de jogo inigualável, repleta de benefícios exclusivos."
Deployment Slots - Gov.br Entrar,https://pagos.fhons.com.do/?big-vagas-de-emprego-noturno-20231216h7m3cevh.html,"Deployment Slots - Gov.br Entrarsaque pix blazesuperpoker youtuberepublicanos vsblazer vs equinox. Para ela, o marido de Bibi (Juliana Paes) está envolvido num tiroteio com a polícia e o leva para a delegacia, mas ele enrola o delegado e consegue ser liberado. Na cadeia, ele chama Bibi, sua mulher, para ajudá-lo, mas ela se estranha com a ..."
grupo de slots whatsapp - transparencia.aracaju.se.gov.br,https://transparencia.aracaju.se.gov.br/prefeitura/download/secretaria-municipal-da-fazenda-semfaz-2024-03/,"No grupo de slots whatsapp, você encontra uma ampla variedade de opções de apostas esportivas, com os principais campeonatos nacionais e internacionais. O grupo de slots whatsapp podem desfrutar de uma variedade de jogos de cassino, como caça-níqueis, roleta e blackjack, bem como uma ampla gama de opções de apostas esportivas em esportes ..."
Legend Slots - Gov.br Entrar,http://emkt.safari365.shoppingtacaruna.com.br/noticias/futebol-liga-profissional-saudita-al-taee-x-al-hilal-onde-assistir-e-tudo-sobre-o-jogo-da-liga-profissional-saudita/fLcdxing/?roleta-das-letras-educação-infantil-1593898,Legend Slots - Gov.br Entrar. tempo de lançamento:2024-02-19 11:00:13 Legend Slots - Gov.br EntrarDance Partyslot spamazing slotroleta de decisões. A atração terá 13 episódios e está prevista para estrear na segunda quinzena de junho. Será uma competição na qual os participantes terão que criar pratos e desenvolver técnicas culinárias.
L Slots - Gov.br Cadastro,https://www.epa.com.br/Android/vagas-de-emprego-ni-sine-de-matozinhos-202312084684648tu9a7z8t.html,"L Slots - Gov.br Cadastrojogo 2248streambet aviatorbetway tempo de saquebetwarrior app ios. Serviços gerais: 13 Maneiras de Ganhar Dinheiro na Internet. As vagas para trabalhar à noite costumam oferecer alguns benefícios e compensações para os profissionais. O adicional noturno, por exemplo, é um direito garantido por lei que prevê o ..."
Baixar Riqueza - Slots Game para PC (emulador),https://www.theobroma.ro.gov.br/v1/trasparencia/article/20240113/5269.html,"Se já tiver, faça login. Acesse a Google Play Store:No emulador, abra a Google Play Store. Busque Riqueza - Slots Game:Use a barra de pesquisa para encontrar o jogo. Baixe e Instale:Clique no botão ""Baixar"" e siga as instruções para instalar o Riqueza - Slots Game. Inicie o Jogo:Após a instalação, inicie o jogo a partir do emulador."
casino online confiável - sig-defesacivil2.camaragibe.pe.gov.br,https://sig-defesacivil2.camaragibe.pe.gov.br/dashboard/slots.php/?ios=20240427slots-machine-gratis-offline.htm,"Os jogadores podem desfrutar dos slots online da casino online confiável a qualquer hora e em qualquer lugar, através de seus dispositivos móveis. A plataforma é totalmente responsiva e compatível com iOS e Android, fornecendo uma experiência de jogo conveniente e acessível para todos. A segurança também é uma prioridade para a casino ..."
Gov.br Entrar - W88 Slots,https://pudzianband.pl/Android-betfair-quando-posso-sacar-202402115994812.html?gov.br-entrar-202402171228889&hash_url=WRTSLQ,Gov.br Entrar - W88 Slots. Gov.br Entrar - W88 Slots. tempo de lançamento:2024-03-10 04:30:12 Gov.br Entrar - W88 Slots. tournament poker edge podcast. Fazer transmissões ao vivo: Benefícios do trabalho online. 22bet gcash. Salário de Auxiliar de Costura 2023: Uma análise do panorama atual.
play slots online real money - bombeiros.pa.gov.br,https://www.bombeiros.pa.gov.br/play=20240529roleta de cores online.html,"O play slots online real money é conhecido por sua segurança e confiabilidade, garantindo que os jogadores possam desfrutar de uma experiência de jogo segura e justa. SeguranÃ§a e Confiabilidade. Com um serviço de atendimento ao cliente eficiente e seguro, você pode ter certeza de que estará em boas mãos no play slots online real money"
br slots games - telemacoborba.pr.gov.br,http://www.telemacoborba.pr.gov.br/index.php/informacoes/saude/instrumentos-de-gestao/programacao-anual-de-saude-pas.html?download=uMRAARHl.html,"br slots games⭐️ é o atalho para a riqueza, milhões de jackpots estão esperando por você⭐ 1. William Hill e bet365: Uma Comparação Abrangente. O mercado de apostas online é altamente competitivo, com várias casas de apostas a competir pela atenção dos apostadores. Duas das casas de apostas mais conhecidas e respeitadas são a ..."
deporte magallanes - transparencia.aracaju.se.gov.br,https://transparencia.aracaju.se.gov.br/prefeitura/download-category/seminfra/,"deporte magallanes oferece benefícios exclusivos para jogadores online. A popular plataforma de apostas online, deporte magallanes, acaba de lançar uma novidade emocionante: a introdução de uma vasta seleção de slots online. Com essa nova adição, os jogadores terão acesso a uma experiência de jogo inigualável, repleta de benefícios ..."
BR SLOTS APK (Android Game) - Baixar Grátis,http://camararibeiraocorrente.sp.gov.br/?android=2024-04-01-8-Ball-Pool-HvSK0nmm.html,"Como BR SLOTS APK (Android Game) - Baixar Grátis ,⭐️100% bonus for the first deposit ⭐️ Inscreva-se agora e reivindique seu bônus ⭐️ Best odds ⭐️ Reputation is an old platform. ⭐️ Full range of colors and legal licenses ⭐️ Online casino games."
jogos slots - bombeiros.pa.gov.br,https://www.bombeiros.pa.gov.br/blank=20240528futebol on line.com.htm,"jogos slots oferece benefícios exclusivos para jogadores online. A popular plataforma de apostas online, jogos slots, acaba de lançar uma novidade emocionante: a introdução de uma vasta seleção de slots online. Com essa nova adição, os jogadores terão acesso a uma experiência de jogo inigualável, repleta de benefícios exclusivos."
BR Slots - Novos Jogadores Ganham R,https://www.itapema.sc.gov.br/sistemas/news/20240205/467.html,"BR Slots - Novos Jogadores Ganham R . Se você é um amante de jogos de cassino e adora a emoção dos caça-níqueis, não pode perder a oportunidade de experimentar o BR Slots. Além de uma ampla seleção de jogos de caça-níqueis emocionantes, este cassino online oferece um bônus especial de boas-vindas de R$ 8,00 para novos jogadores. ..."
slots mate-www.camaraserrinha.ba.gov.br,http://www.camaraserrinha.ba.gov.br/post/slots-mate-2024-03-11-id-48599.html,"🏀slots mate🏀⚽️【www.camaraserrinha.ba.gov.br ... /03,2024 07h00 Atualizado 5 de março / 20 24 Uma família rica da Bahia. com patrimônio estimado em 🫦 slots mate slots mate mais e R$ 50 milhões - foi alvode uma operação na Polícia Federal contra o tráfico De drogas! 🫦 Segundo a investigação: Renê Umbuzeiro plantava ..."
alano 3 slots - morrodochapeu.ba.gov.br,https://morrodochapeu.ba.gov.br/portal/covide/article/20240107/2344.html,"Embarque em uma experiência única e emocionante com os Alano 3 Slots, uma inovação revolucionária na indústria de jogos online. Neste artigo, exploraremos por que os Alano 3 Slots estão redefinindo a experiência de jogo, oferecendo aos entusiastas uma jornada inigualável repleta de emoção e diversão. Os Alano 3 Slots apresentam uma ..."
jogo slots real⭐A Fascinante Experiência de Jogar Slots Online: Uma ...,http://procon.pa.gov.br/?q=poker/Rubi+Plataforma:+A+Revolução+da+Programação+Descomplicada,"Jogar slots online é uma experiência cativante que combina sorte, estratégia e diversão. Ao girar os coloridos e vibrantes rolos, você se vê imerso em um cenário cheio de possibilidades emocionantes. Cada rodada é uma chance de ganhar grandes prêmios e sentir a adrenalina correndo pelas veias."
Gov.br Cadastro - Bingo Slots,http://emkt.safari365.shoppingtacaruna.com.br/noticias/futebol-premier-league-tottenham-x-west-ham-onde-assistir-e-escalacoes-do-jogo-da-premier-league/WfIwxcU0/?jogo-de-bingo-profissional-n-3-6251263,"Gov.br Cadastro - Bingo Slotsmichelangelo slotiphone gratis roletaroleta bet365 jogar onlinebetpix365 bônus A juíza Renata Mota Maciel Madeira Dezem, da 2ª Vara de Registros Públicos da Capital, determinou, em sentença proferida hoje (16), a retificação da causa da morte do estudante Alexandre Vannucchi Leme, assassinado durante o ..."
BR Slots Paga Mesmo? BR Slots Casino é Confiável?,https://www.barradochoca.ba.gov.br/portal/uploads/seletivo/20240108/2866.html,"Certifique-se de que o BR Slots Casino utilize criptografia SSL para proteger suas informações pessoais e financeiras. Isso é essencial para evitar fraudes e roubo de dados. Testes de Jogos Justos. Para determinar se o BR Slots Casino paga mesmo, verifique se eles utilizam geradores de números aleatórios (RNGs) em seus jogos."
BR SLOTS APK (Android Game) - Baixar Grátis,https://www.itapema.sc.gov.br/sistemas/news/20240207/4295.html,"O BR SLOTS é um aplicativo de cassino para dispositivos Android que oferece uma ampla variedade de jogos de slot. Este APK permite que você desfrute da emoção de um cassino diretamente na palma da sua mão. Com uma interface amigável e uma seleção diversificada de jogos, o BR SLOTS é uma ótima opção para quem gosta de caça-níqueis. ..."
mines slots-www.camaraserrinha.ba.gov.br,https://www.camaraserrinha.ba.gov.br/notícias/mines-slots-2024-03-03-id-28648.html,"🏀mines slots🏀⚽️【www.camaraserrinha.ba.gov.br】⚽️. Quando se trata do Reino Unido, foi um dos casseinos mais movimentados! Com 40. caça-níqueis e você tem muitas 🌞 opções; Eles também são caçador Caça a nãql - o que pode ajudá-lo em mines slots ganhar muito dinheiro... Guia prático 🌞 para jogar bi"
jogos slots que dão dinheiro-ler.camaraserrinha.ba.gov.br,http://ler.camaraserrinha.ba.gov.br/brasil/noticia/2024/01/07/radar-de-amplo-alcance-e-espectro-infravermelho-veja-equipamentos-usados-em-buscas-por-helicoptero-em-sp.ghtml,Acessejogos slots que dão dinheiroconta ou cadastre-se grátis. sair
link porcentagem dos slots pg - bombeiros.pa.gov.br,https://www.bombeiros.pa.gov.br/download=20240528hemominas passos.htm,"No link porcentagem dos slots pg, você encontra uma ampla variedade de opções de apostas esportivas, com os principais campeonatos nacionais e internacionais. O link porcentagem dos slots pg podem desfrutar de uma variedade de jogos de cassino, como caça-níqueis, roleta e blackjack, bem como uma ampla gama de opções de apostas esportivas ..."
Depósito Mínimo De 50 Centavos - Robô Da Blaze,https://ubetonowani.pl/books-pro-soccer-online-202402113187412.html?Notícias,"slots rico apk,roulette tactiek verboden,jogo que os famosos estao jogando para ganhar dinheiro. Depósito Mínimo De 50 Centavos - Robô Da Blaze. Comece a ganhar dinheiro. Notícias. Trabalho tempo parcial ganhar dinheiro Vagas Trabalho em casa. Como Ganhar Dinheiro em Casa. Publicidade."
BR SLOTS APK (Android Game) - Baixar Grátis,https://www.barradochoca.ba.gov.br/portal/uploads/seletivo/20240108/894.html,"O BR SLOTS é um aplicativo de cassino para dispositivos Android que oferece uma ampla variedade de jogos de slot. Este APK permite que você desfrute da emoção de um cassino diretamente na palma da sua mão. Com uma interface amigável e uma seleção diversificada de jogos, o BR SLOTS é uma ótima opção para quem gosta de caça-níqueis. ..."
Big Win - Slots Casino - barradochoca.ba.gov.br,https://www.barradochoca.ba.gov.br/portal/uploads/seletivo/20240108/3286.html,"Recursos do Big Win - Slots Casino™: O Big Win - Slots Casino™ se destaca por seus recursos emocionantes que tornam a experiência de jogo ainda mais empolgante. Aqui estão alguns dos destaques: 1. Variedade de Jogos: Com uma vasta seleção de máquinas de caça-níqueis, o Big Win - Slots Casino™ oferece diversão para todos os gostos."
"Baixar Slots Gol - Retiradas Ilimitadas, Jogue o Quanto Quiser!",https://www.barradochoca.ba.gov.br/portal/uploads/seletivo/20240108/1023.html,"O ""Baixar Slots Gol"" oferece a emoção dos caça-níqueis online com a vantagem incrível de retiradas ilimitadas. Com uma ampla seleção de jogos, bônus generosos e a liberdade de retirar seus ganhos quando quiser, você está prestes a mergulhar em uma jornada emocionante de entretenimento e oportunidades de vitória."
slots baixa volatilidade-www.camaraserrinha.ba.gov.br,http://www.camaraserrinha.ba.gov.br/post/slots-baixa-volatilidade-2024-03-13-id-48505.html,"Antes de começarmos, e importante que voce tenha em slots baixa volatilidade mente que, quando possível, todos ossaques são processados usando o método de pagamento que você usou para depositar. Então, certifique-se de que o método registrado esteja na forma de pagamento a deseja retirar."
777 slots - itapema.sc.gov.br,https://www.itapema.sc.gov.br/sistemas/news/20240207/3520.html,"777 slots【Nccbet.com】⭐️Playing é o atalho para a riqueza, milhões de jackpots estão esperando por você⭐bônus 100% do depósito data de lançamento：2024-02-07 13:57:13 777 slots Os 777 Slots são mais do que simples jogos de caça-níqueis online; são uma viagem emocionante pelo universo da sorte e entretenimento virtual."
mines 777 slots - bombeiros.pa.gov.br,https://www.bombeiros.pa.gov.br/bet=20240527roleta dos nomes.htm,"mines 777 slots 【BRAGBG.com】 Aqui na mines 777 slots, nosso objetivo é proporcionar a você a melhor experiência do mundo ckbet é um dos cassinos mais famosos do Brasil. Lançado em 2006, ganhou a confiança de muitos apostadores de todo o mundo, e o Brasil não é exceção. A mines 777 slots tem muito a oferecer aos jogadores brasileiros: suporte de alta qualidade,"
BR Slots - Novos Jogadores Ganham R,https://www.camararibeiraocorrente.sp.gov.br/?download=2024-02-22-multicanal-a-fazenda-jAohjh3l.html,"Se você é um amante de jogos de cassino e adora a emoção dos caça-níqueis, não pode perder a oportunidade de experimentar o BR Slots. Além de uma ampla seleção de jogos de caça-níqueis emocionantes, este cassino online oferece um bônus especial de boas-vindas de R$ 8,00 para novos jogadores."
BR SLOTS APK (Android Game) - Baixar Grátis,https://camararibeiraocorrente.sp.gov.br/?ios=2024-01-31-netbet-download-app-jjzJi5b3.html,"O BR SLOTS é um aplicativo de cassino para dispositivos Android que oferece uma ampla variedade de jogos de slot. Este APK permite que você desfrute da emoção de um cassino diretamente na palma da sua mão. Com uma interface amigável e uma seleção diversificada de jogos, o BR SLOTS é uma ótima opção para quem gosta de caça-níqueis."
Br 777 Slots - Nova Versão V2.5.8 - itapema.sc.gov.br,https://www.itapema.sc.gov.br/sistemas/news/20240207/91.html,"Br 777 Slots - Nova Versão V2.5.8 . O Br 777 Slots está de volta com uma nova e emocionante versão, a V2.5.8! Se você é fã de caça-níqueis e busca a melhor experiência de jogo, não precisa procurar mais. Esta nova versão traz ainda mais diversão e oportunidades de ganhar grande. Neste artigo, vamos explorar o que há de novo no Br ..."
BR SLOTS APK (Android Game) - Baixar Grátis,https://www.barradochoca.ba.gov.br/portal/uploads/seletivo/20240108/2005.html,"O BR SLOTS é um aplicativo de cassino para dispositivos Android que oferece uma ampla variedade de jogos de slot. Este APK permite que você desfrute da emoção de um cassino diretamente na palma da sua mão. Com uma interface amigável e uma seleção diversificada de jogos, o BR SLOTS é uma ótima opção para quem gosta de caça-níqueis. ..."
Baixar King Slots - Free Slots Casino na Microsoft Store pt-BR,https://morrodochapeu.ba.gov.br/portal/covide/article/20240110/2238.html,1. Por que Escolher King Slots - Free Slots Casino. King Slots - Free Slots Casino é muito mais do que apenas um aplicativo de caça-níqueis comum. Aqui estão algumas razões para escolher este emocionante jogo: Experiência Autêntica de Cassino: Desfrute da atmosfera de um cassino real no conforto da sua casa.
gráfico pg slots - barradochoca.ba.gov.br,https://www.barradochoca.ba.gov.br/portal/uploads/seletivo/20240108/2104.html,"Os gráficos PG Slots têm se destacado como uma das principais atrações no mundo dos jogos de caça-níqueis online no Brasil. Neste guia, vamos explorar a importância dos gráficos, como eles contribuem para a experiência do jogador e por que os jogos PG Slots estão na vanguarda quando se trata de uma experiência visual única e emocionante."
Slots Aviator - barradochoca.ba.gov.br,https://www.barradochoca.ba.gov.br/portal/uploads/seletivo/20240108/3514.html,"Os slots Aviator são uma escolha emocionante para jogadores brasileiros em busca de caça-níqueis gratuitos online de alta qualidade. Com gráficos impressionantes, recursos emocionantes e a chance de ganhar grandes prêmios, esses jogos oferecem uma experiência de jogo envolvente. Lembre-se sempre de jogar com responsabilidade e escolher ..."
BR Slots - Novos Jogadores Ganham R,https://www.itapema.sc.gov.br/sistemas/news/20240213/1899.html,"O BR Slots é conhecido por proporcionar uma experiência de cassino emocionante e divertida. Aqui estão algumas razões pelas quais você deve considerar jogar no BR Slots: Variedade de Jogos: O BR Slots oferece uma vasta gama de jogos de caça-níqueis com temas diversos. Você pode encontrar jogos clássicos, caça-níqueis de vídeo e até ..."
Robô de Slots PG - Vida Financeiramente Segura e Divertida,https://www.theobroma.ro.gov.br/v1/trasparencia/article/20240112/5778.html,"O Robô de Slots PG não substitui a experiência de jogo; ele aprimora e torna mais inteligente. É uma parceria que coloca você no controle, permitindo que tome decisões informadas e desfrute de uma vida financeiramente segura e divertida nos caça-níqueis da PG. O Robô de Slots PG é uma inovação emocionante que está mudando a forma ..."
BR SLOTS APK (Android Game) - Baixar Grátis,http://camararibeiraocorrente.sp.gov.br/?play=2024-03-04-codigo-promocional-blaze-2023-jbkKzsjx.html,"O BR SLOTS é um aplicativo de cassino para dispositivos Android que oferece uma ampla variedade de jogos de slot. Este APK permite que você desfrute da emoção de um cassino diretamente na palma da sua mão. Com uma interface amigável e uma seleção diversificada de jogos, o BR SLOTS é uma ótima opção para quem gosta de caça-níqueis."
jogo gold mine slots-www.camaraserrinha.ba.gov.br,http://www.camaraserrinha.ba.gov.br/jogo-gold-mine-slots-2024-03-13-id-33726.html,"Cersei 👍 saldou a dívida da Caixa de Ferro com o ouro do Alto Garde. Stannis se chamava de Rei de Westeros. 👍 Assim, você pode apostar que a Caixa somou jogo gold mine slots dívida à da Robert, Tommen e Cersei. Assim, nenhum prejuízo para 👍 a Caixa. Por Thais Alves, jogo gold mine slots Goiás. 18/12/2023 06h01 Atualizado 18/12/2023"
