title,href,body
BR Slots - Novos Jogadores Ganham R - camararifaina.sp.gov.br,http://www.camararifaina.sp.gov.br/?casino=2024-05-01-bingo-grátis-show-ball-3-playbonds-p5K0zAjy.html,"BR Slots - Novos Jogadores Ganham R . ⭐️ 100% bonus for the first deposit ⭐️ Inscreva-se agora e reivindique seu bônus ⭐️ Best odds ⭐️ Reputation is an ⭐️ Full range of colors and legal licenses ⭐️ Online casino games. Se você é um amante de jogos de cassino e adora a emoção dos caça-níqueis, não pode perder a ..."
br slots - pim.saude.rs.gov.br,https://www.pim.saude.rs.gov.br/pim_a/videos/?app=fortune tiger slot demo_jw48wxg2hvznhw8.shtml,br slots curso básico público.9.8. br slots abertoV2.15.3. br slots área de fofocas de modaV1.18.6. br slots Três Reinos 2V2.20.4. br slots escrita inglesaV3.5.1. br slots Trinta e seis estratégiasV1.13.10. br slots Filme de terrorV2.8.5. br slots MontenegroV1.9.10
Play Online Slots BR - itapema.sc.gov.br,https://www.itapema.sc.gov.br/sistemas/news/20240207/4593.html,"Play Online Slots BR【Nccbet.Com】⚡No primeiro depósito de 20, é possível obter 10 do valor em bônus⚡ data de lançamento：2024-02-07 14:10:08 Play Online Slots BR Os caça-níqueis online se tornaram uma forma popular de entretenimento no Brasil, proporcionando uma experiência emocionante e conveniente para os entusiastas de jogos ..."
Play Online Slots BR - barradochoca.ba.gov.br,https://www.barradochoca.ba.gov.br/portal/uploads/seletivo/20240107/1548.html,"Play Online Slots BR. futebol interior. Descubra a Paixão do Futebol com Betano. Play Online Slots BR LIVE Os caça-níqueis online se tornaram uma forma popular de entretenimento no Brasil, proporcionando uma experiência emocionante e conveniente para os entusiastas de jogos de azar. Neste guia abrangente, vamos explorar como jogar caça ..."
jack slots paga mesmo - Apostas diárias de futebol: Apostando em todos ...,http://www.telemacoborba.pr.gov.br/informacoes/concursos.html?download=bound 2 tradução-2024-05-28.html,"jack slots paga mesmo LIVE ruelle up in flames torrent ""Fórmula do Cassino - Como Aumentar Suas Chances de Ganhar Dinheiro - Descubra Como Jogar e Aumentar Suas Chances de Ganhar"" Al-Ahli🐯, de Firmino, acerta a contratação de promessa da Espanha***** ⚡ O Al-Ahli ..."
BR Slots Paga Mesmo? BR Slots Casino é Confiável?,https://www.itapema.sc.gov.br/sistemas/news/20240206/1807.html,"Certifique-se de que o BR Slots Casino utilize criptografia SSL para proteger suas informações pessoais e financeiras. Isso é essencial para evitar fraudes e roubo de dados. Testes de Jogos Justos. Para determinar se o BR Slots Casino paga mesmo, verifique se eles utilizam geradores de números aleatórios (RNGs) em seus jogos."
layaslots⭐A Revolução dos Jogos de Cassino Online: Descubra o Mundo ...,https://academiavirtual.inpi.gov.br/moodle/course/view.php?xzid=Descubra+o+Fascinante+Mundo+da+Estrela+Farmacia:+O+Segredo+para+uma+Saude+Radiante,"A conveniência de jogar a qualquer momento e em qualquer lugar, juntamente com a possibilidade de experimentar novos lançamentos regularmente, tornam os slots online uma opção popular para os entusiastas de cassinos. Prepare-se para explorar um universo de diversão e potenciais ganhos enquanto desbrava o excitante mundo dos slots online."
Baixar King Slots - Free Slots Casino na Microsoft Store pt-BR,https://morrodochapeu.ba.gov.br/portal/covide/article/20240108/2807.html,"Como Baixar King Slots - Free Slots Casino na Microsoft Store pt-BR,【Nccbet.Com】⚡Nas compras com código PROMO30 ganhe 30% de desconto mais frete grátis para todo o Brasil."
BR Slots Paga Mesmo? BR Slots Casino é Confiável?,https://www.itapema.sc.gov.br/sistemas/news/20240208/1300.html,"Certifique-se de que o BR Slots Casino utilize criptografia SSL para proteger suas informações pessoais e financeiras. Isso é essencial para evitar fraudes e roubo de dados. Testes de Jogos Justos. Para determinar se o BR Slots Casino paga mesmo, verifique se eles utilizam geradores de números aleatórios (RNGs) em seus jogos."
BR SLOTS APK (Android Game) - Baixar Grátis,https://www.theobroma.ro.gov.br/v1/trasparencia/article/20240112/6037.html,"O BR SLOTS é um aplicativo de cassino para dispositivos Android que oferece uma ampla variedade de jogos de slot. Este APK permite que você desfrute da emoção de um cassino diretamente na palma da sua mão. Com uma interface amigável e uma seleção diversificada de jogos, o BR SLOTS é uma ótima opção para quem gosta de caça-níqueis. ..."
Play Online Slots BR - itapema.sc.gov.br,https://www.itapema.sc.gov.br/sistemas/news/20240206/4834.html,"Play Online Slots BR . Os caça-níqueis online se tornaram uma forma popular de entretenimento no Brasil, proporcionando uma experiência emocionante e conveniente para os entusiastas de jogos de azar. Neste guia abrangente, vamos explorar como jogar caça-níqueis online no Brasil, destacando as vantagens, oferecendo dicas para maximizar a ..."
Baixar King Slots - Free Slots Casino na Microsoft Store pt-BR,https://www.theobroma.ro.gov.br/v1/trasparencia/article/20240112/15.html,1. Por que Escolher King Slots - Free Slots Casino. King Slots - Free Slots Casino é muito mais do que apenas um aplicativo de caça-níqueis comum. Aqui estão algumas razões para escolher este emocionante jogo: Experiência Autêntica de Cassino: Desfrute da atmosfera de um cassino real no conforto da sua casa.
Slots online - pinhais.pr.gov.br,https://pinhais.pr.gov.br/app/1013x5co.shtml,"Slots online【Bet55.Com】⭐️Bet55 é o atalho para a riqueza, milhões de jackpots estão esperando por você⭐️De acordo com o IBGE, que divulgou os dados do indicador nesta quarta-feira (11), depois de recuarem 0,91% em agosto, os preços dos produtos alimentícios caíram 0,74% em setembro.O movimento é contrário ao dos preços dos produtos não alimentícios, que tiveram alta de ..."
brasil game slots - telemacoborba.pr.gov.br,http://www.telemacoborba.pr.gov.br/servicos/guia-de-servicos/obituario/17476-falecimentos-do-dia-30-11-2022.html?play=20240406lotsa-slots-2023.html,"brasil game slots⭐️ é o atalho para a riqueza, milhões de jackpots estão esperando por você⭐ Total de Minutos dos Gols: Aposte no Tempo Certeiro. Introdução. Apostar no futebol é uma das formas mais emocionantes de vivenciar este desporto cativante. Uma das opções de aposta mais populares é o ""Total de Minutos dos Gols"", que ..."
slots da pg⭐Explorando a Fascinante Dimensão dos Slots da PG,https://www.governadoredisonlobao.ma.gov.br/Descubra a Ilusão da Sorte: A Verdade Sobre o Vies do Apostador-bt-o,slots da pg⭐Descubra o universo intrigante e emocionante por trás dos slots da PG. Explore a tecnologia e a diversão por trás desses jogos de cassino online. Ir para o conteúdo. TRANSPARÊNCIA DIÁRIO MUNICIPAL e-SIC PORTAL DO PROFESSOR COVID-19 VACINAÇÃO NFS-e PORTAL DO ALUNO
BR Slots Paga Mesmo? BR Slots Casino é Confiável?,https://www.theobroma.ro.gov.br/v1/trasparencia/article/20240112/221.html,"Certifique-se de que o BR Slots Casino utilize criptografia SSL para proteger suas informações pessoais e financeiras. Isso é essencial para evitar fraudes e roubo de dados. Testes de Jogos Justos. Para determinar se o BR Slots Casino paga mesmo, verifique se eles utilizam geradores de números aleatórios (RNGs) em seus jogos."
slots real baixar⭐Desvendando o Mundo dos Slots Online: Uma Experiência ...,https://www.governadoredisonlobao.ma.gov.br/A Fascinante Historia da Divisão do Uruguai: Conflitos e Consequências-bt-o,slots real baixar⭐Explore um universo emocionante de caça-níqueis virtuais e descubra a fascinante interação entre o jogador e as máquinas de slots online. Ir para o conteúdo. TRANSPARÊNCIA DIÁRIO MUNICIPAL e-SIC PORTAL DO PROFESSOR COVID-19 VACINAÇÃO NFS-e PORTAL DO ALUNO
segredo dos slots - Jogos online: Diversão e oportunidades de ganhar ...,https://www.anchieta.es.gov.br/selecao/detalhes/110/processo-seletivo-no-008-2024-motorista-condutor-de-transporte-de-emergencia?app=xmegadrive-2024-05-28.html,"segredo dos slots LIVE jogos gratis online ""Fórmula de caça-níqueis - Como aumentar suas chances de ganhar - Descubra como jogar caça-níqueis e aumentar suas chances de ganhar"" Athletic anuncia saída🤣 de😁 Cícero Júnior após acesso na Série D do Brasileiro 2023***** 🐅 Athletic confirma saída🤣 de😁 Cícero Júnior após ..."
slots congonhas - Programação de ligas de futebol: Ao vivo e ...,http://www.telemacoborba.pr.gov.br/servidores/manuais-e-procedimentos/1874-manual-de-instrucao-patrimonial-e-procedimentos-administrativos-e-operacionais-de-almoxarifado.html?download=bet win-2024-05-28.html,"classificações de betis . bets nacional apostas ""Jogando Roleta Online - Experiência Virtual em um Cassino Online - Aprenda a Jogar Roleta"" Amador de Prudente reunirá 77 times divididos em 4 torneios***** Os campos e quadras de Presidente Prudente ficarão bastante agitados nos últimos meses deste ano. O Campeonato Amador reunirá 77 times divididos em quatro torneios."
Baixar King Slots - Free Slots Casino na Microsoft Store pt-BR,https://biblioteca.cofen.gov.br/wp-includes/images/crystal/news/20231118/951.html,"Baixar King Slots - Free Slots Casino na Microsoft Store pt-BR,⭐️100% bonus for the first deposit ⭐️ Inscreva-se agora e reivindique seu bônus ⭐️ Best odds ⭐️ Reputation is an old platform. ⭐️ Full range of colors and legal licenses ⭐️ Online casino games."
BR Slots Paga Mesmo? BR Slots Casino é Confiável?,https://biblioteca.cofen.gov.br/wp-includes/images/crystal/news/20231105/1217.shtml,"BR Slots Casino é Confiável?⚡️Inscreva-se agora e reivindique seu bônus⚡️ Se você é um entusiasta de jogos de cassino online, é natural ter perguntas sobre a confiabilidade de plataformas como o BR Slots Casino. Afinal, a segurança e a integridade financeira são preocupações essenciais para qualquer jogador."
Play Online Slots BR - theobroma.ro.gov.br,https://www.theobroma.ro.gov.br/v1/trasparencia/article/20240131/3501.html,"Play Online Slots BR . Os caça-níqueis online se tornaram uma forma popular de entretenimento no Brasil, proporcionando uma experiência emocionante e conveniente para os entusiastas de jogos de azar. Neste guia abrangente, vamos explorar como jogar caça-níqueis online no Brasil, destacando as vantagens, oferecendo dicas para maximizar a ..."
lucky step - telemacoborba.pr.gov.br,http://www.telemacoborba.pr.gov.br/servicos/portal-do-cidadao/iptu-legislacao/decretos-iptu/19503-decreto-28985-2022.html?video=jogo-cash-slots-paga-24-04-2024.html,"lucky step. Description. resultado da quina concurso 5922 ""PG Online Slots: altas taxas de pagamento e jogos emocionantes."" Show more. 483403. 91586. 41289. 23544. 112058."
Fezbet cassino - acr poker - pinheiros.es.gov.br,https://www.pinheiros.es.gov.br/selecao/acesso/entrar?download=20240512miracle-slots.html,"Fezbet cassino - acr poker oferece benefícios exclusivos para jogadores online. A popular plataforma de apostas online, Fezbet cassino - acr poker, acaba de lançar uma novidade emocionante: a introdução de uma vasta seleção de slots online. Com essa nova adição, os jogadores terão acesso a uma experiência de jogo inigualável, repleta ..."
Como Jogar Poker Em Casa - Roletas Ao Vivo,https://www.indieshuffle.com/hot-poker-variants-4tqi6e4_8818928,microgaming slots. gov.br entrar. kong casino. leon bet login. jogar subway surf. Receba mensalmente novos cupons. Marcas comerciais pertencem a seus respectivos donos. A presença de uma marca comercial no gambling jogo não significa qualquer relacionamento entre as partes. Facebook;
456bet com slots casino⭐Descubra a Emocionante Experiência de Jogar ...,http://procon.pa.gov.br/?q=news/A+Saga+dos+Goleadores:+Brasilierão+2023,"26/05/2024. Explore a diversão e a adrenalina dos slots no 456bet Cassino e mergulhe em um mundo de entretenimento emocionante. Seja transportado para um universo de cores vibrantes, sons envolventes e oportunidades de vitória emocionantes ao jogar slots no 456bet Cassino"
Borabill - Games Que Dão Dinheiro De Verdade,https://formations-mapi.u-bordeaux.fr/page/login?888-casino-vincite-20240214lmtq.html,"Borabill - Games Que Dão Dinheiro De Verdademelhor jogo online para ganhar dinheiroonline slots real money canadaleovegas login ukpoker club metacritic O governo indonésio, a população e a mídia expressaram insatisfação com o vídeo promocional, acusando a Malásia de ""roubar"" a cultura indonésia e promovê-la como se fosse sua."
qual jogo do brabet paga mais - prodemge.gov.br,https://wwws.prodemge.gov.br/informacoes/sobre-a-ac-prodemge-2?casino=20240513777-bravo-slots.htm,"A popular plataforma de apostas online, qual jogo do brabet paga mais, acaba de lançar uma novidade emocionante: a introdução de uma vasta seleção de slots online. Com essa nova adição, os jogadores terão acesso a uma experiência de jogo inigualável, repleta de benefícios exclusivos. Os slots oferecidos pela qual jogo do brabet paga ..."
BR SLOTS APK (Android Game) - Baixar Grátis,https://www.itapema.sc.gov.br/sistemas/news/20240207/3309.html,"O BR SLOTS é um aplicativo de cassino para dispositivos Android que oferece uma ampla variedade de jogos de slot. Este APK permite que você desfrute da emoção de um cassino diretamente na palma da sua mão. Com uma interface amigável e uma seleção diversificada de jogos, o BR SLOTS é uma ótima opção para quem gosta de caça-níqueis. ..."
Baixar King Slots - Free Slots Casino na Microsoft Store pt-BR,https://www.theobroma.ro.gov.br/v1/trasparencia/article/20240131/1942.html,1. Por que Escolher King Slots - Free Slots Casino. King Slots - Free Slots Casino é muito mais do que apenas um aplicativo de caça-níqueis comum. Aqui estão algumas razões para escolher este emocionante jogo: Experiência Autêntica de Cassino: Desfrute da atmosfera de um cassino real no conforto da sua casa.
woo: slots rush casino⭐Desperte a sua sorte: A emocionante jornada no ...,https://academiavirtual.inpi.gov.br/moodle/course/view.php?xzid=Bitcoin+Crash+Game:+A+Thrilling+Experience+in+the+Crypto+World,"Descubra uma experiência de jogo fascinante e repleta de adrenalina no Slots Rush Casino, onde a sorte está ao seu alcance. Prepare-se para uma viagem inesquecível neste universo de diversão e emoção. No Slots Rush Casino, mergulhe em um mundo de cores vibrantes e gráficos deslumbrantes, onde a ação nunca para"
pg slots pg slots - 2023 - itapema.sc.gov.br,https://www.itapema.sc.gov.br/sistemas/news/20240205/117.html,"Os PG Slots são uma das formas mais emocionantes de entretenimento de cassino disponíveis em 2023. Com uma ampla variedade de jogos e muitas surpresas a serem reveladas, este é o momento ideal para explorar o que os PG Slots têm a oferecer. Não perca a oportunidade de experimentar a diversão e emoção da era dos PG Slots em 2023!"
Slotsluck Baixar - Omdöme Om 888casino,https://callcenter.fen.uchile.cl/hot/Qual-é-o-limite-de-saque-no-Banco-24-Horas?baixar-jogos-202401062512651.html,panda slots. slot game w88. slots casino las vegas slots. gov.br entrar. Receba mensalmente novos cupons. Marcas comerciais pertencem a seus respectivos donos. A presença de uma marca comercial no bet365 astropay não significa qualquer relacionamento entre as partes. Facebook; Twitter;
online casino slots uk⭐Explorando o Universo Vibrante dos Caça-Níqueis ...,http://procon.pa.gov.br/?q=news/Descubra+a+Nova+Forma+de+Obter+o+Windows+10S+de+2022+Gratuitamente!,Explorando o Fascinante Mundo dos Slots da Sorte Desvendando os Segredos da Motivação: Como Iniciar a Semana com o Pé Direito O Poder Atemporal da Idade: Van Dijk VS Relógios Desvendando os Misteriosos Segredos da Bet 7k Descubra a Emoção de Ganhar no Jogo do Bicho Descubra a Emocionante Experiência de Usar a Plataforma F12.Bet
Play Online Slots BR - itapema.sc.gov.br,https://www.itapema.sc.gov.br/sistemas/news/20240207/3178.html,"Play Online Slots BR . Os caça-níqueis online se tornaram uma forma popular de entretenimento no Brasil, proporcionando uma experiência emocionante e conveniente para os entusiastas de jogos de azar. Neste guia abrangente, vamos explorar como jogar caça-níqueis online no Brasil, destacando as vantagens, oferecendo dicas para maximizar a ..."
Br 777 Slots - Nova Versão V2.5.8,https://www.camararibeiraocorrente.sp.gov.br/?download=2024-03-30-tipo-jogo-de-tabuleiro-SAoKDwwl.html,"O Br 777 Slots está de volta com uma nova e emocionante versão, a V2.5.8! Se você é fã de caça-níqueis e busca a melhor experiência de jogo, não precisa procurar mais. Esta nova versão traz ainda mais diversão e oportunidades de ganhar grande. Neste artigo, vamos explorar o que há de novo no Br 777 Slots e por que você deve ..."
5gb slots 777 - riogrande.rs.gov.br,https://www.riogrande.rs.gov.br/corona/?app=app para ganhar dinheiro assistindo vídeos no youtube.shtml,"5gb slots 777⚡️Inscreva-se agora e reivindique seu bônus⚡️ Atlético-GO terá Heron e Baralhas no time titular contra o Botafogo-SP***** Embalado na Série B com cinco vitórias e um empate nas últimas seis rodadas, o Atlético-GO espera manter o ritmo contra o Botafogo-SP, sábado, fora de casa, pela 28ª rodada."
slots ricos⭐Slots Ricos: Uma Abordagem Inovadora para Potencializar Sua ...,http://procon.pa.gov.br/?q=blank/Desvendando+os+Segredos+da+Bigorna+Tributaria,slots ricos⭐Descubra como os slots ricos podem transformar a maneira como você interage com a enciclopédia inteligente. Uma visão aprofundada sobre como essa tecnologia revolucionária pode melhorar sua experiência de busca de informações.
casino slots for real money - prodemge.gov.br,https://wwws.prodemge.gov.br/component/phocadownload/category/19-a3-token?play=20240514hot-fruits.html,"Jogos Online/Ao Vivo +18. Bem-vindo ao casino slots for real money, o destino definitivo para uma experiÃªncia emocionante de apostas online. Neste guia abrangente, vamos explorar as caracterÃ­sticas Ãºnicas da plataforma, desde jogos empolgantes atÃ© bÃ´nus generosos, proporcionando a vocÃª uma jornada inesquecÃ­vel no mundo das ..."
br 777 slots - pim.saude.rs.gov.br,https://www.pim.saude.rs.gov.br/pim_a/video/?app=jogo de cartas estrela.html,"br 777 slots⚡️Inscreva-se agora e reivindique seu bônus⚡️ Em vitória do Atlético-MG, goleiro reserva brilha em defesa: ""A gente ganhou o jogo ali"", diz ídolo Victor***** A vitória do Atlético-MG contra o São Paulo marcou a primeira partida do goleiro Matheus Mendes desde maio de 2021. Ele acabou como um dos destaques do Galo no ..."
Baixar King Slots - Free Slots Casino na Microsoft Store pt-BR,https://www.theobroma.ro.gov.br/v1/trasparencia/article/20240115/4983.html,1. Por que Escolher King Slots - Free Slots Casino. King Slots - Free Slots Casino é muito mais do que apenas um aplicativo de caça-níqueis comum. Aqui estão algumas razões para escolher este emocionante jogo: Experiência Autêntica de Cassino: Desfrute da atmosfera de um cassino real no conforto da sua casa.
br 777 slots - V3.2.5,https://www.saude.al.gov.br/nnwwtb.html,"br 777 slots . que será dividido entre todos os condenadosjogo devourA Selic está em 11,75% ao ano.O consumidor está ficando bastante sombrio e se as expectativas de inflação continuarem elevadas, isso pode forçar o Fed a apertar ainda mais""Abilio deu contribuição fundamental para o varejo, setor está de luto, diz nota da Abras"
jogo de slots - apps.semsa.manaus.am.gov.br,https://apps.semsa.manaus.am.gov.br/arquivomorto/video.php?uri=codigos-blox-fruits-2024-05-17.html,"jogo de slots⭐️Playing é o atalho para a riqueza, milhões de jackpots estão esperando por você⭐️. 7games app. Bem-vindo ao 7games app, a melhor maneira de mergulhar em um oceano infinito de diversão e entretenimento!"
casinos slots - tramandai.rs.gov.br,http://tramandai.rs.gov.br/casinos-slots.php?kw=casinos-slots&20240219,"A história dos slots de casino. Agora que você sabe como funcionam os slots de casino, vamos viajar no tempo e descobrir a história por trás dessas incríveis máquinas de jogos. Os primeiros slots de casino surgiram no final do século XIX e eram muito diferentes dos modelos modernos que conhecemos hoje."
Play Online Slots BR - theobroma.ro.gov.br,https://www.theobroma.ro.gov.br/v1/trasparencia/article/20240112/148.html,"Play Online Slots BR【Nccbet.Com】⚡Nas compras com código PROMO30 ganhe 30% de desconto mais frete grátis para todo o Brasil. data de lançamento：2024-01-12 15:18:17 Play Online Slots BR Os caça-níqueis online se tornaram uma forma popular de entretenimento no Brasil, proporcionando uma experiência emocionante e conveniente para os ..."
watch sports live - intranet.parademinas.mg.gov.br,http://intranet.parademinas.mg.gov.br/index.php/?bet=20240323grande-slots-zeus.htm,"Os slots oferecidos pela watch sports live são desenvolvidos por alguns dos melhores provedores de jogos do mercado, garantindo gráficos de tirar o fôlego, trilhas sonoras envolventes e recursos inovadores. Com uma biblioteca em constante expansão, os jogadores terão uma ampla variedade de opções para escolher, desde temas clássicos ..."
O Mundo dos Sigma Slots - itapema.sc.gov.br,https://www.itapema.sc.gov.br/sistemas/news/20240206/273.html,"Sigma Slots Caça-níqueis ao vivo【Nccbet.com】⭐️Playing é o atalho para a riqueza, milhões de jackpots estão esperando por você⭐ data de lançamento：2024-02-06 13:28:24 Sigma Slots Se você é um amante de jogos de caça-níqueis em busca da melhor experiência de jogo sem gastar dinheiro, você está prestes a descobrir um tesouro!"
spin slots - telemacoborba.pr.gov.br,http://www.telemacoborba.pr.gov.br/servicos/portal-do-cidadao/itbi-legislacao/lei-itbi/135-servicos/portal-do-cidadao/iptu-legislacao.html?app=novo-slots-08-04-2024.html,"spin slots-⭐️Fornece serviços e produtos de apostas online, especialmente tabela de probabilidades de apostas em futebol spin slots-probabilidades de futebol - probabilidades de casas de apostas ⭐️"
Free Cellular Slots - Port of Hastings Corporation,https://media.portofhastings.vic.gov.au/free-cellular-slots/,"Our free slots online are around for all kinds of products. In many areas, Mega Moolah is apparently a regular 5-reel position with twenty-five paylines and several multipliers tossed on the combine. There are even movies slots that have lowest RTP, occasionally below 90percent. Online slots pay whenever a player outlines right up effective ..."
online casino slots canada⭐Explore a Emocionante Aventura dos Caça ...,https://academiavirtual.inpi.gov.br/moodle/course/view.php?xzid=Desbravando+a+Emoção+dos+Confrontos+Sul-Americanos+na+Copa+Sul-Americana,Desvendando os Mistérios dos Slots: Experimente a Magia da Aleatoriedade A fascinante jornada das formigas cortadeiras: Compreendendo a complexa sociedade e comportamento destes minúsculos insetos trabalhadores A incrível jornada de Carlinhos Maia: Descubra os bastidores do fenômeno das redes sociais
frenzy slot paga mesmo⭐Descubra a Emocionante Frenesi dos Slots: Uma ...,https://www.governadoredisonlobao.ma.gov.br/Leven - Descubra a Revolução em Saude Personalizada na Farmacia de Manipulação em Santos-bt-ofeed/,"frenzy slot paga mesmo⭐Explore o universo envolvente e lucrativo dos slots com Frenzy Slot, uma experiência de jogo eletrizante que vai além das expectativas. Descubra a adrenalina e as recompensas neste emocionante artigo."
online casino super slots⭐Descubra a Experiência Envolvente dos Super ...,https://cmpalmeirandia.ma.gov.br/blank/A Revolução da Inteligência Artificial: Megapari,"Se você busca uma experiência de entretenimento inigualável, os super slots em cassinos online são a escolha perfeita Com gráficos impressionantes, trilhas sonoras envolventes e uma variedade de temas cativantes, os jogos de slot online transportam os jogadores para mundos imaginários repletos de chances de ganhar prêmios incríveis"
deportivo municipal x cienciano - intranet.parademinas.mg.gov.br,http://intranet.parademinas.mg.gov.br/index.php/?games=20240319jackpot-blaze-slots.htm,"Os slots oferecidos pela deportivo municipal x cienciano são desenvolvidos por alguns dos melhores provedores de jogos do mercado, garantindo gráficos de tirar o fôlego, trilhas sonoras envolventes e recursos inovadores. Com uma biblioteca em constante expansão, os jogadores terão uma ampla variedade de opções para escolher, desde temas ..."
lance.com - pinheiros.es.gov.br,http://www.pinheiros.es.gov.br/?download=20240417spin-boom-slots.html,"Os jogadores podem desfrutar dos slots online da lance.com a qualquer hora e em qualquer lugar, através de seus dispositivos móveis. A plataforma é totalmente responsiva e compatível com iOS e Android, fornecendo uma experiência de jogo conveniente e acessível para todos. A segurança também é uma prioridade para a lance.com Slots."
best free slots online - pegou o resultado da quina,http://jatei.ms.gov.br/ios/zst4d/,"best free slots online. pokerstars 300 freeroll password, site de apostas brasileiro A dúvida é se haverá uma versão ""pura?do Moto Z2, sem a tela Shattershield; até o momento, não houve nenhum vazamento relacionado ao modelo. No ano passado, as duas versões foram lançadas, mas só a edição ""não-Force?foi disponibilizada no Brasil."
