title,href,body
fruit slots brabet estratégia - riogrande.rs.gov.br,https://www.riogrande.rs.gov.br/video/slots-party.shtm,fruit slots brabet estratégia jogos de copa ouroV2.20.4. fruit slots brabet estratégia kik cassinoV3.5.1. fruit slots brabet estratégia jogo brabet funcionaV1.13.10. fruit slots brabet estratégia let the flames begin legendadoV2.8.5. fruit slots brabet estratégia guitar hero through the fire and flames onlineV1.9.10
escuro slots - camaracuiaba.mt.gov.br,https://www.camaracuiaba.mt.gov.br/index.php?app=plano de aula sobre aposto e vocativo 8º ano-2024-05-26.html,"escuro slots 11.32.10 escuro slots. 4.98 789694 reviews 10,000,000+ Downloads Free partidas de ceará sc x fortaleza esporte clube ""Casinos Online na Tailândia - Fonte de Diversão e Entretenimento - Descubra Cassinos Online Interessantes na Tailândia"" Google Play"
melhores slots para ganhar dinheiro - novorepartimento.pa.gov.br,https://novorepartimento.pa.gov.br/web/?download=kto-aviator-02-11-2023.html,"melhores slots para ganhar dinheiro⚡️Inscreva-se agora e reivindique seu bônus⚡️Gabigol lidera número de cartões do Flamengo no ano*****. Gabigol foi expulso na derrota do Flamengo por 3 a 0 para o Athletico Paranaense, nesta quarta-feira, em Cariacica. O atacante rubro-negro levou cartão vermelho após dar uma braçada em Cuello, em lance revisado pelo VAR (veja no vídeo abaixo)."
Rivalo Casino Slots Mga Slots - ios V2.3.2 - webmail.serra.es.gov.br,https://webmail.serra.es.gov.br/h/offline.jsp?56865373/97713311,"Explore o cassino de slots online do Brasil com Rivalo Casino Slots Mga Slots! Tudo, desde máquinas caça-níqueis clássicas até caça-níqueis mais recentes! ️ Mais de 4500 análises de slots online para PC/Mac ️ Mais de 1200 slots móveis ️ Novas atualizações diárias de slots! Os 100 melhores cassinos online confiáveis para satisfazer qualquer jogador!"
промокоды 1xbet телеграм,https://semitour.com/player/3Dx07cyj.html,ruby slots. gov.br cadastro. brabet saque. techbigs. Receba mensalmente novos cupons. Marcas comerciais pertencem a seus respectivos donos. A presença de uma marca comercial no pixbet gratis apk não significa qualquer relacionamento entre as partes. Facebook; Twitter;
codigo de convite betfair - mail.fazendavilanova.rs.gov.br:8083,http://mail.fazendavilanova.rs.gov.br:8083/video/classic slots online.shtml,"daily cash slots win everyday paga mesmo⚡️Inscreva-se agora e reivindique seu bônus⚡️Ituano x Tombense: ingressos à venda para jogo da Série B; veja valores e como comprar*****. O Ituano abriu a venda de ingressos para o jogo contra o Tombense, nesta quarta-feira, às 19h, no estádio Novelli Júnior.A partida é válida pela 21ª rodada da Série B do Campeonato Brasileiro."
Blaze The Most - Domino Jogatina Download,http://emkt.safari365.shoppingtacaruna.com.br/noticias/futebol-liga-profissional-saudita-al-taee-x-al-hilal-onde-assistir-e-tudo-sobre-o-jogo-da-liga-profissional-saudita/fLcdxing/?onde-procurar-vagas-de-empregos-em-curitiba,"Blaze The Most - Domino Jogatina Downloadbetsson premier leaguemelhores slots bet365convidar amigo bet365quanto tempo cai o dinheiro da blaze. Fowler, de 24 anos, teve uma discussão com uma mulher em uma festa há alguns dias. Ele a chamou com raiva de mulher gorda. A mulher que foi repreendida não estava disposta a ser humilhada."
aposta no jogo da copa-drogariasultrapopular.com.br,https://drogariasultrapopular.com.br/notícias/bet-335-2023-12-17-id-2721.htm,"slots que mais pagam betano; slots que mais pagam betclic; aposta no jogo da copa:notícias. Notícias curiosas, inusitadas, polêmicas e bizarras, por Fernando Moreira. Jornalista. 05/12/2023 08h04 Atualizado 05/12/2023. Um ."
Slots free play - acessoainformacao.fortaleza.ce.gov.br,https://acessoainformacao.fortaleza.ce.gov.br/video/2023-11-30-Slots free play.shtm,"Slots free play 11.33.10 Slots free play. 4.99 88.868,789 reviews 100,000,000+ Downloads Free Slots free play【Bet55 jogo】⭐️Bet55 é um atalho para ficar rico, milhões de jackpots estão esperando por você, convide seus amigos para ganhar bônus enormes⭐️ Google Play"
tabela dos jogos do brasil - camaraquevedos.rs.gov.br,http://camaraquevedos.rs.gov.br/news.php/?download=202404285g-slots.htm,"Outra vantagem é a flexibilidade. Os jogadores podem desfrutar dos slots online da tabela dos jogos do brasil a qualquer hora e em qualquer lugar, através de seus dispositivos móveis. A plataforma é totalmente responsiva e compatível com iOS e Android, fornecendo uma experiência de jogo conveniente e acessível para todos."
jornal esportivo - seplag.mt.gov.br,http://www.seplag.mt.gov.br/index.php?blank=20240407club-jockey-slots-sorte-2023.html,"Os slots oferecidos pela jornal esportivo são desenvolvidos por alguns dos melhores provedores de jogos do mercado, garantindo gráficos de tirar o fôlego, trilhas sonoras envolventes e recursos inovadores. Com uma biblioteca em constante expansão, os jogadores terão uma ampla variedade de opções para escolher, desde temas clássicos até ..."
rtp slot pragmatic⭐Explorando a Emocionante Aventura dos Jogos de RTP ...,https://www.governadoredisonlobao.ma.gov.br/Desvende o Desafiador Mundo do Crash BC Game-bt-o,"Os jogos de RTP Slots Pragmatic oferecem aos jogadores uma experiência de jogo eletrizante, com uma variedade de temas cativantes, gráficos impressionantes e recursos inovadores. Ao girar os rolos, os jogadores podem se deparar com emocionantes rodadas de bônus, multiplicadores generosos e grandes prêmios em dinheiro"
Resultado Agreste - 22bet Minimum Withdrawal - detro.rj.gov.br,http://www.detro.rj.gov.br/uploads/app.php?tabela-roleta-brasileira-202402077tsdx1nyj.html,playnet slots. gov.br entrar. Receba mensalmente novos cupons. Marcas comerciais pertencem a seus respectivos donos. A presença de uma marca comercial no hublot watch não significa qualquer relacionamento entre as partes. Facebook; Twitter;
gambino slots: máquinas casino - riogrande.rs.gov.br,https://www.riogrande.rs.gov.br/video/grande-slots.shtml,"2023-08-23 13:45:08 fonte:gambino slots: máquinas casino ` ABC e Guarani se enfrentam nesta quarta-feira, às 21h30 (de Brasília), na Arena das Dunas, em Natal. O duelo é válido pela 18ª rodada da Série B do Campeonato Brasileiro 2023 ."
SEPLAG/MT Escritorio de Processos,http://egprocessos.seplag.mt.gov.br/orgao/29?download=20240408treasure-slots-adventures.htm,melhor-app-de-aposta-esportiva qiuqiu-poker-royale diamond-treasures 20bet-retirar-dinero fortune-infinity blaze-slots-5 aviator-game-pin-up bet55-é-confiável big-big-baller-roll domino-vamos-slot blaze-resultados pagcor-slot bet365-primeiro-deposito bet365-encerrar-aposta cupom-de-aposta-grátis betano-qual-pais bonus-de-boas-vindas jogo-8 ...
Betway Casino - Live Roulette Gratis,https://cap.ugb.edu.br/conheca-o-cap/?dattani-poker,frankenstein free slots. gov.br cadastro. Receba mensalmente novos cupons. Marcas comerciais pertencem a seus respectivos donos. A presença de uma marca comercial no sites de apostas brasileiros não significa qualquer relacionamento entre as partes. Facebook; Twitter;
SEPLAG/MT Escritorio de Processos,http://egprocessos.seplag.mt.gov.br/orgao/17?blank=20240403tesouro-dos-slots-de-cartas.html,slots-club-louco dynamite-0800 campea-de-casino-vegas-slots slot-machines-win-real-money-cash-app blaze-casino-jogos elite-gentlemens betfair-kifizetés como-ganhar-na-blaze slots-rei-jogos-de-cassino griesstätt-heimatapp ... mt.gov.br; PT; Contatos; Menu. Carta de Serviços . Manual Técnico. ESCRITÓRIO DE GERENCIAMENTO DE PROCESSOS ACESSE ...
da para ficar rico com apostas esportivas_777 gems,https://www.ipt.br/2023-11-08-jlipkmptvv.html,"slots 1 centimo; telegram poker; da para ficar rico com apostas esportivas. 2023-12-14 06:47:01. da para ficar rico com apostas esportivas：Jogadores estão usando Flight Simulator para sobrevoar Furacão Laura. Geralmente, esses documentos são registrados pouco antes do lançamento nos países. Portanto, quando uma certificação é ..."
PDF App De Jogos Para Ganhar Dinheiro Real,https://legrandjeu.laposte.fr/documents/Reglement_TFFA_2024.pdf?Township-202401239864353.html,888 casino best slots. gov.br cadastro. rider 777 login. ufc wetten online. mini roulette demo. Receba mensalmente novos cupons. Marcas comerciais pertencem a seus respectivos donos. A presença de uma marca comercial no jogos que mais pagam não significa qualquer relacionamento entre as partes.
bet apostas - transparencia.valereal.rs.gov.br:8083,http://www.transparencia.valereal.rs.gov.br:8083/?video=slots-real-jogo.shtml,slots bull 4343; cassino online 326; bounce 4 less 8419; jogos 5 sentidos 2011; online premier bet 2011; blaze.apostas 2749; mega sena 25 03 389; concha slots 3706; resultado dos jogos de hoje à noite 1531; through the fire and flames 4 shared 3025; rtp slot ao vivo 4809
Betsport Consulta - Jogo Do Fogo E Da Agua,https://www.secpb.org.br/booksYWTAmte6.html,extra slots. gov.br cadastro. cash out betano. Receba mensalmente novos cupons. Marcas comerciais pertencem a seus respectivos donos. A presença de uma marca comercial no porque labirinthus não significa qualquer relacionamento entre as partes. Facebook; Twitter;
qual é o próximo jogo do santos - Slots e jogos de cassino ...,https://www.camaracuiaba.mt.gov.br/index.php?app=rioprevidencia contracheque-2024-05-20.html,qual é o próximo jogo do santos - Slots e jogos de cassino: Oportunidades para ganhar dinheiro e se divertir. Chen Jiahong; 2024-05-20 23:05:02
os dez últimos resultado da quina - Análises de futebol e notícias ...,https://www.anchieta.es.gov.br/selecao/detalhes/113/processo-seletivo-no-009-2024-agente-comunitario-de-saude-acs?app=santander acordo boleto-2024-05-26.html,os dez últimos resultado da quina - Slots de Jackpot: Diversão e oportunidades de ganhar. Lu Jialing; Chen Shuji; Lin Xiaoting; Bai Yuling; Yao Guanyu; Liu Hongxin. os dez últimos resultado da quina. Chen Xinyao. Zhou Mingsheng. os dez últimos resultado da quina LIVE
【união esporte bets】slots cassino - dzivo.sjr.ma.gov.br,http://dzivo.sjr.ma.gov.br/smkei/,"união esporte bets【Vcc88.Com】⚡No primeiro depósito de 20, é possível obter 10 do valor em bônus⚡Em nosso teste, ao fazer uma limpeza desses sites foi possível liberar 1GB de espaço em nosso aparelho, mas esse tamanho pode variar de acordo com o tempo que você usa o navegador. Após realizar o procedimento, você não deverá notar nenhuma mudança no Chrome, apenas o espaço ..."
caça-níqueis online - Blaze,http://www.pinheiros.es.gov.br/?android=20240428spinning-unicom-slots.html,"Os slots oferecidos pela caça-níqueis online - Blaze são desenvolvidos por alguns dos melhores provedores de jogos do mercado, garantindo gráficos de tirar o fôlego, trilhas sonoras envolventes e recursos inovadores. Com uma biblioteca em constante expansão, os jogadores terão uma ampla variedade de opções para escolher, desde temas ..."
cef loteria - ibiai.mg.gov.br,http://ibiai.mg.gov.br/guia-de-iptu/?android=20240407three-kingdoms-slots.htm,"Os jogadores podem desfrutar dos slots online da cef loteria a qualquer hora e em qualquer lugar, através de seus dispositivos móveis. A plataforma é totalmente responsiva e compatível com iOS e Android, fornecendo uma experiência de jogo conveniente e acessível para todos. A segurança também é uma prioridade para a cef loteria Slots."
xbets 360 apostas - servicos.garibaldi.rs.gov.br:8083,http://servicos.garibaldi.rs.gov.br:8083/?video=viva-slots-vegas.shtml,jogos slots com bonus de cadastro 2011; the flames in the flood 2749; bandar taruhan casino cbet online 389; brabet código promocional 3706; casino állás 1531; win slot 3025; jogos libertadores 2023 4809
loteria loteria da caixa - pinheiros.es.gov.br,http://www.pinheiros.es.gov.br/?bet=20240427casino-slots:-super-win.html,"Os slots oferecidos pela loteria loteria da caixa são desenvolvidos por alguns dos melhores provedores de jogos do mercado, garantindo gráficos de tirar o fôlego, trilhas sonoras envolventes e recursos inovadores. Com uma biblioteca em constante expansão, os jogadores terão uma ampla variedade de opções para escolher, desde temas ..."
【drop the hop】cassino slots - jatei.ms.gov.br,https://jatei.ms.gov.br/zed/osuen/,"drop the hop【Vcc88.Com】⚡No primeiro depósito de 20, é possível obter 10 do valor em bônus⚡Para a conta detalhada, foram considerados investimentos em hardware, software, serviços, nuvem, terceirização de processos de negócios (do inglês, Business Process Outsourcing, ou apenas BPO), estatais e exportações."
jogos cassino gratis - Adeus ao Mundo: Cassinos online na Tailândia ...,https://www.anchieta.es.gov.br/selecao/detalhes/113/processo-seletivo-no-009-2024-agente-comunitario-de-saude-acs?download=áfrica do sul jogos olímpicos-2024-05-25.html,"discretionary bonus ""Jackpot Slots - Grande diversão no jogo e chances de ganhar."" Cartoleiro vence rodada #26 da liga ge🎁 TV Diário com🇺🇲 Tiquinho capitão e base do😃 Botafogo***** O ""F. ARABELA FC"", do😃 cartoleiro Sidnei, venceu a rodada #26 da liga ge🎁 TV Diário com🇺🇲 79.49 pontos. ,"
slots br - transparencia.caurj.gov.br,https://transparencia.caurj.gov.br/tabelas-salariais/?casino=888-casino-server-status-2024-03-14.html,"slots br oferece benefícios exclusivos para jogadores online. A popular plataforma de apostas online, slots br, acaba de lançar uma novidade emocionante: a introdução de uma vasta seleção de slots online. Com essa nova adição, os jogadores terão acesso a uma experiência de jogo inigualável, repleta de benefícios exclusivos."
top slots⭐Descubra a Magia dos Melhores Caça-Níqueis Online,https://www.governadoredisonlobao.ma.gov.br/Crazy exhilarating game: The Ultimate Guide to Claze-bt-o,"top slots⭐Explore um mundo de diversão e emoção com os principais slots online. Saiba como você pode se envolver em experiências de jogo emocionantes e recompensadoras, repletas de surpresas e oportunidades de vitória."
número da mega sena de hoje - ensino.bombeiros.pa.gov.br,https://ensino.bombeiros.pa.gov.br/index.php/play/2024-05-28slotspg.shtml,"Outra vantagem é a flexibilidade. Os jogadores podem desfrutar dos slots online da número da mega sena de hoje a qualquer hora e em qualquer lugar, através de seus dispositivos móveis. A plataforma é totalmente responsiva e compatível com iOS e Android, fornecendo uma experiência de jogo conveniente e acessível para todos."
jogos slots⭐Desvendando o Mundo Encantado dos Slots Online: Uma Jornada ...,https://www.governadoredisonlobao.ma.gov.br/Desmistificando a Inteligência Artificial: A Evolução da Enciclopedia Inteligente-bt-o,"Explore o emocionante universo dos jogos slots online, onde a sorte e a adrenalina se encontram. Descubra como essa forma de entretenimento cativante pode proporcionar uma experiência única e empolgante. Ao adentrar o mundo dos slots online, fui envolvido por uma atmosfera vibrante e cheia de possibilidades"
slots agora.com⭐Descubra a emoção de apostar no slots agora.com,https://belavista.ma.gov.br/root/Desvendando o Estilo Elegante: Combinação Perfeita entre Vestido Canelado e Blazer,slots agora.com⭐Explore a experiência fascinante de jogar nos slots do slots agora.com e mergulhe em um mundo de entretenimento emocionante. Atendimento: Segunda - Sexta 10:00 - 17:00 MAPA DO SITE
clash slot⭐A Revolução do Choque: Uma Experiência Eletrizante com Slots ...,https://cmmarajadosena.ma.gov.br/download/Mega Ball 100x: A Revolução nas Loterias,"Ao adentrar o universo dos slots, somos imersos em uma atmosfera vibrante e cheia de surpresas. Cada giro das bobinas é como um choque de adrenalina, proporcionando uma experiência única a cada vez. A variedade de temas e recursos dos slots modernos cativa nossa atenção, mantendo-nos entretidos por horas a fio ..."
slots que pagam no cadastro⭐Descubra os Segredos dos Slots Pagos no ...,https://santoamaro.ma.gov.br/news/Iluminando o Caminho: Descubra o Fascinante Mundo da Blaze,slots que pagam no cadastro⭐Explore um mundo de possibilidades ao usar slots que oferecem pagamentos já no cadastro. Saiba como essa maneira inovadora de jogar pode transformar sua experiência de cassino online. Ir para o conteúdo. TRANSPARÊNCIA DIÁRIO MUNICIPAL e-SIC COVID-19 VACINAÇÃO NFS-e
top slot⭐O Fascinante Mundo dos Slots de Última Geração,https://cmpalmeirandia.ma.gov.br/ios/Desvende a Emocionante Experiência no Bora 777 Slot,"Os slots de top slot são uma fusão perfeita entre entretenimento e inovação, transcendendo as fronteiras do convencional e levando os jogadores a uma jornada emocionante. Prepare-se para mergulhar em um mundo de possibilidades e emoções intensas com os incríveis slots de última geração."
slots online uk⭐Descubra a Emoção Infinita dos Slots Online no Reino ...,https://cmpalmeirandia.ma.gov.br/app/O Classico de Yorkshire: O Confronto Entre Huddersfield Town e Leeds Analisado Estatisticamente,"A conveniência de jogar a qualquer hora, em qualquer lugar, aliada à emoção de apostar e ganhar, torna os slots online uma escolha popular entre os entusiastas de jogos de cassino. De iniciantes a jogadores experientes, há algo para todos desfrutarem nos emocionantes slots online do Reino Unido."
goinbet slots⭐Desvendando as Maravilhas do Mundo dos Slots de Goinbet,https://belavista.ma.gov.br/download/O Brilho e a Raça do Grêmio: Uma Jornada de Superação e Paixão,goinbet slots⭐Explore a emoção e a diversão dos slots de Goinbet neste artigo envolvente. Descubra os segredos por trás dos jogos e mergulhe nessa experiência única. Atendimento: Segunda - Sexta 10:00 - 17:00
melhores plataformas slots⭐Desvendando o Mundo dos Slots Online ...,https://mataroma.ma.gov.br/news/Desvendando a Emocionante Jornada da LVbet Ekstraklasa,melhores plataformas slots⭐Explore as melhores plataformas de slots online para uma experiência emocionante e recompensadora. Descubra os segredos por trás dos jogos mais populares e mergulhe nesse universo fascinante.
jogar slots gratis⭐Desvende a emocionante jornada de jogar slots ...,https://santoamaro.ma.gov.br/download/A Revolução dos Conhecimentos: A Ascensão da Enciclopedia Inteligente,jogar slots gratis⭐Descubra a emocionante experiência de jogar slots de forma gratuita e mergulhe no mundo fascinante das máquinas caça-níqueis virtuais. Explore a diversão e a adrenalina dos jogos de slot sem arriscar seu dinheiro.
jili slots demo⭐Descubra a Emocionante Experiência de Jogar Jili Slots ...,https://turiacu.ma.gov.br/root/A Inteligência Artificial Transformando a Busca por Conhecimento,jili slots demo⭐Explore o mundo dos jogos de azar online com Jili Slots Demo e desfrute de uma experiência emocionante e envolvente. Saiba como essa plataforma inovadora pode proporcionar diversão e entretenimento para jogadores de todos os níveis.
7u slots⭐Explorando a Fascinante Tecnologia dos Slots 7u,https://turiacu.ma.gov.br/news/A Revolução do PicPay: Descubra Como Evoplay Cassino Esta Impulsionando os Rendimentos,"7u slots⭐Descubra a incrível inovação por trás dos slots 7u e como eles estão revolucionando a experiência de jogo online. Este artigo explora os recursos únicos, as vantagens e o potencial futuro desses slots emocionantes."
88 fortunes slots casino tragamonedas gratis⭐Descubra a Magia das Slots ...,https://cmpocaodepedras.ma.gov.br/download/Desvendando a Bet: A Ciência por Tras das Apostas,88 fortunes slots casino tragamonedas gratis⭐Embarque em uma emocionante aventura de casino com as Slots 88 Fortunes e experimente a sorte e a riqueza nesse jogo cativante. Descubra os segredos por trás das fortunas escondidas nas bobinas e sinta a adrenalina de cada giro. Prepare-se para uma experiência única repleta de emoção e desafios!
wild cash casino slots paga mesmo⭐Descubra a Emoção de Ganhar na Wild ...,https://cmpocaodepedras.ma.gov.br/download/Desfrute da Emocionante Experiência de Jogar a Dois no Cassino 31Bets,"Explore a adrenalina de jogar wild cash casino slots e descubra como você pode ser um vencedor! Prepare-se para entrar em um mundo de emoções e possibilidades com as incríveis wild cash casino slots! Ao girar os cilindros e torcer pelos símbolos certos, você pode experimentar a empolgação de ganhar grandes prêmios"
slot que da dinheiro no cadastro⭐Descubra o Segredo por Trás dos Slots ...,https://cmpalmeirandia.ma.gov.br/app/Descubra a Emoção das Telegram Apostas no Betano: Uma Experiência Unica de Entretenimento Online,"Explore o fascinante mundo dos slots online que te recompensam simplesmente por se cadastrar. Saiba como aproveitar essa oportunidade única e desfrutar de benefícios instantâneos! Bem-vindo ao emocionante universo dos jogos de slots online, onde a sorte e a surpresa se encontram! Imagine só, ao se cadastrar em um cassino virtual, ser ..."
slot online grￃﾡtis⭐Desvende a Emoção dos Slots Online: Uma Experiência ...,https://mataroma.ma.gov.br/play/Aluguel de Blazers em São Paulo: Elegância e Sofisticação à sua Porta,"slot online grￃﾡtis⭐Descubra a emocionante jornada dos slots online, mergulhando em um mundo virtual de diversão e suspense. Explore os mistérios dos jogos de cassino online e desfrute de uma experiência de jogo única e envolvente."
