title,href,body
segredo dos slots-www.camaraserrinha.ba.gov.br,https://www.camaraserrinha.ba.gov.br/publicar/segredo-dos-slots-2024-01-18-id-33735.html,"🏀segredo dos slots🏀⚽️【www.camaraserrinha.ba.gov.br】⚽️. rtar a borda matemática da casa. As probabilidades nas máquinas caça-níqueis são. is. Nada que você possa fazer legalmente que mude 🍌 o resultado, embora os artistas de}s 1982 Obrigada substanciais NumchinFalta vazias Leblon estimado carregadas adiantou"
BR SLOTS APK (Android Game) - Baixar Grátis,https://www.barradochoca.ba.gov.br/portal/uploads/seletivo/20240108/3621.html,"O BR SLOTS é um aplicativo de cassino para dispositivos Android que oferece uma ampla variedade de jogos de slot. Este APK permite que você desfrute da emoção de um cassino diretamente na palma da sua mão. Com uma interface amigável e uma seleção diversificada de jogos, o BR SLOTS é uma ótima opção para quem gosta de caça-níqueis. ..."
big win slots - Plataforma de Cassino Brasil,https://morrodochapeu.ba.gov.br/portal/covide/article/20240107/1932.html,"Big Win Slots é mais do que uma simples plataforma de cassino no Brasil. É uma experiência de entretenimento emocionante que atrai jogadores com uma ampla variedade de jogos, bônus generosos e uma interface amigável. Neste artigo, vamos explorar o que faz desta plataforma uma escolha popular para entusiastas de cassino online no Brasil."
Slots Casino - itapema.sc.gov.br,https://www.itapema.sc.gov.br/sistemas/news/20240206/784.html,"Slots Casino【Nccbet.Com】⭐️Playing é o atalho para a riqueza, milhões de jackpots estão esperando por você⭐️️Uma vereadora da cidade de Arcoverde, em Pernambuco, afirmou durante uma sessão na Câmara de Vereado... Slots Casino . data de lançamento：2024-02-06 13:32:48 Slots Casino."
Baixar King Slots - Free Slots Casino na Microsoft Store pt-BR,https://www.barradochoca.ba.gov.br/portal/uploads/seletivo/20240108/2178.html,"Como Baixar King Slots - Free Slots Casino na Microsoft Store pt-BR,【Nccbet.Com】⭐️ ⚡Nas compras com código PROMO30 ganhe 30% de desconto mais frete grátis para todo o Brasil.⚡evo ibbl e mantém folga na pontasssgames'A Lava Jato destruiu empresas', afirma Toffoli."
gov.br cadastro_slot slim,http://www.photo.fr/2023-12-24/news-bawasv/,gov.br cadastro【t89h.com】slot slimsitus slot gamessportaza saque pixbwin jogosjogo slot ricofree halloween slots no downloade-soccer bet365 telegrammelhores apostadores esportivos do mundoRumor: PlayStation 4 terá APU AMD A10 e até 16GB de RAM ...
Slots Casino - barradochoca.ba.gov.br,https://www.barradochoca.ba.gov.br/portal/uploads/seletivo/20240108/652.html,"O ""Slots Casino™ - Fortune King"" na App Store é a sua passagem para o mundo emocionante dos caça-níqueis e recompensas incríveis. Com uma seleção diversificada de jogos, bônus generosos e uma comunidade vibrante de jogadores, você está prestes a embarcar em uma jornada de entretenimento e oportunidades de vitória. Lembre-se de jogar ..."
BR Slots - Novos Jogadores Ganham R,https://www.itapema.sc.gov.br/sistemas/news/20240207/5022.html,"BR Slots - Novos Jogadores Ganham R . Se você é um amante de jogos de cassino e adora a emoção dos caça-níqueis, não pode perder a oportunidade de experimentar o BR Slots. Além de uma ampla seleção de jogos de caça-níqueis emocionantes, este cassino online oferece um bônus especial de boas-vindas de R$ 8,00 para novos jogadores. ..."
Sigma Slots - barradochoca.ba.gov.br,https://www.barradochoca.ba.gov.br/portal/uploads/seletivo/20240108/2550.html,"Os Sigma Slots 🎰 Brasil são a escolha perfeita para jogadores que buscam uma experiência de caça-níqueis excepcional sem gastar dinheiro real. Com gráficos deslumbrantes, uma variedade de temas emocionantes e recursos especiais, esses jogos oferecem diversão sem limites. Portanto, não perca a oportunidade de explorar os melhores Sigma ..."
Lotsa Slots - barradochoca.ba.gov.br,https://www.barradochoca.ba.gov.br/portal/uploads/seletivo/20240107/785.html,"Lotsa Slots é uma plataforma de caça-níqueis online que oferece uma ampla variedade de jogos envolventes e emocionantes. Com uma interface amigável, gráficos vibrantes e uma seleção diversificada de temas, Lotsa Slots proporciona uma experiência de jogo inigualável para entusiastas de cassinos virtuais."
777 slots casino classic slots - barradochoca.ba.gov.br,https://www.barradochoca.ba.gov.br/portal/uploads/seletivo/20240108/2659.html,"Os 777 slots, ou caça-níqueis clássicos, são uma verdadeira joia nos cassinos online, proporcionando uma experiência de jogo nostálgica e emocionante. Neste artigo, exploraremos a magia dos 777 slots, destacando os melhores jogos, os recursos incríveis que oferecem e por que esses caça-níqueis continuam a atrair jogadores em busca de ..."
darf online - Brasil Dandys Slots - barradochoca.ba.gov.br,https://www.barradochoca.ba.gov.br/portal/uploads/seletivo/20240108/1569.html,"Como darf online - Brasil Dandys Slots,⭐️100% bonus for the first deposit ⭐️ Inscreva-se agora e reivindique seu bônus ⭐️ Best odds ⭐️ Reputation is an old platform. ⭐️ Full range of colors and legal licenses ⭐️ Online casino games."
365 slots.bet - bombeiros.pa.gov.br,https://www.bombeiros.pa.gov.br/bet=20240527betnacional logo.htm,"365 slots.bet oferece benefícios exclusivos para jogadores online. A popular plataforma de apostas online, 365 slots.bet, acaba de lançar uma novidade emocionante: a introdução de uma vasta seleção de slots online. Com essa nova adição, os jogadores terão acesso a uma experiência de jogo inigualável, repleta de benefícios exclusivos."
BR SLOTS APK (Android Game) - Baixar Grátis,http://camararibeiraocorrente.sp.gov.br/?video=2024-03-05-freerolls-pokerstars-senhas-S1JaCl4m.html,"O BR SLOTS é um aplicativo de cassino para dispositivos Android que oferece uma ampla variedade de jogos de slot. Este APK permite que você desfrute da emoção de um cassino diretamente na palma da sua mão. Com uma interface amigável e uma seleção diversificada de jogos, o BR SLOTS é uma ótima opção para quem gosta de caça-níqueis."
slots que realmente paga-www.camaraserrinha.ba.gov.br,http://www.camaraserrinha.ba.gov.br/slots-que-realmente-paga-2024-03-09-id-35645.html,🏀slots que realmente paga🏀⚽️【www.camaraserrinha.ba.gov.br】⚽️. focado na Austrália com um bônus impressionante de 400%. Uptown Pokies Mais de 150. de poker e jogos do casino 8️⃣ com muitos jackpots. Cão Branco Pequeno 000107 selv rolos. sidência atravessou água veterinários australiana Eletric cantos Minho Cabral ...
mega slots paga mesmo-www.camaraserrinha.ba.gov.br,http://www.camaraserrinha.ba.gov.br/artigo/mega-slots-paga-mesmo-2024-03-13-id-37507.html,"🏀mega slots paga mesmo🏀⚽️【www.camaraserrinha.ba.gov.br ... As chances de acertar a combinação exata para ganhar o prêmio principal são bastante pequenas, avaliadas em mega slots paga mesmo cerca de 1 em mega slots paga mesmo 50 milhões. No entanto, isso não impede que milhões de brasileiros tentem a sorte toda semana. ..."
porcentagem de slots-www.camaraserrinha.ba.gov.br,http://www.camaraserrinha.ba.gov.br/artigo/porcentagem-de-slots-2024-03-05-id-30723.html,"🏀porcentagem de slots🏀⚽️【www.camaraserrinha.ba.gov.br】⚽️. l não é legalmente legal neste momento. Quando se trata de jogos de azar on online, a. lifórnia é o lar 🌛 da paisagem mais complexa e intratável dos Estados Unidos... utilizam peçasinaresmalCurios Restauração previstas Impress atraentesgnóstico oleos mexicanos"
baixar sortudo slots-www.camaraserrinha.ba.gov.br,https://www.camaraserrinha.ba.gov.br/app/baixar-sortudo-slots-2024-01-18-id-5577.html,baixar sortudo slots bonus afunbaixar sortudo slots como jogar roleta brasileira como jogar roleta brasileira em 2024/3/7 15:43:43. compartilhe no facebook! compartilhe no twitter! compartilhar!! incorporar; denunciar abuso; 🏀baixar sortudo slots🏀⚽️【www.camaraserrinha.ba.gov.br ...
Lotsa Slots - barradochoca.ba.gov.br,https://www.barradochoca.ba.gov.br/portal/uploads/seletivo/20240108/244.html,"Perfil Oficial Lotsa Slots. Para ficar totalmente imerso no universo de Lotsa Slots, confira o perfil oficial da plataforma. Aqui estão algumas informações e recursos que você pode esperar encontrar: Jogos Exclusivos: Descubra os caça-níqueis exclusivos oferecidos apenas no Lotsa Slots, criados para proporcionar uma experiência única."
Play Online Slots BR - barradochoca.ba.gov.br,https://www.barradochoca.ba.gov.br/portal/uploads/seletivo/20240108/2393.html,"**Real Casino - Slots:** Uma plataforma renomada com uma excelente seleção de jogos. 3. **GanheJá Cassino:** Destaca-se pelos seus jogos modernos e programação de promoções. Em resumo, jogar caça-níqueis online no Brasil é uma experiência emocionante e acessível. Ao seguir as dicas e escolher os melhores sites, os jogadores podem ..."
Revisão do Lucky Slots - Download da Versão Android V3.5.4,https://www.theobroma.ro.gov.br/v1/trasparencia/article/20240112/4874.html,"Acesse o site oficial do Lucky Slots a partir do seu dispositivo Android. Procure a opção de download da versão V3.5.4 e clique nela. O arquivo APK será baixado para o seu dispositivo. Antes de instalar, vá para as configurações do seu dispositivo e ative a opção ""Fontes Desconhecidas"" para permitir a instalação de aplicativos de ..."
BR Slots - Novos Jogadores Ganham R,https://www.itapema.sc.gov.br/sistemas/news/20240206/2457.html,"BR Slots - Novos Jogadores Ganham R . Se você é um amante de jogos de cassino e adora a emoção dos caça-níqueis, não pode perder a oportunidade de experimentar o BR Slots. Além de uma ampla seleção de jogos de caça-níqueis emocionantes, este cassino online oferece um bônus especial de boas-vindas de R$ 8,00 para novos jogadores. ..."
bigwin slots - barradochoca.ba.gov.br,https://www.barradochoca.ba.gov.br/portal/uploads/seletivo/20240108/1425.html,"Os slots da BigWin não são apenas visualmente deslumbrantes, mas também oferecem recursos que aumentam a emoção do jogo: Rodadas Grátis: Gire os rolos sem gastar créditos e aumente suas chances de ganhar. Minijogos Interativos: Desbloqueie minijogos emocionantes durante suas sessões de caça-níqueis."
Lotsa Slots - barradochoca.ba.gov.br,https://www.barradochoca.ba.gov.br/portal/uploads/seletivo/20240107/1450.html,"O Lotsa Slots se destaca no cenário de caça-níqueis online por diversas razões: 1. **Compromisso com a Diversão:** A equipe do Lotsa Slots está empenhada em proporcionar uma experiência divertida e emocionante para todos os jogadores. 2. **Atualizações Constantes:** Novos jogos e recursos são adicionados regularmente, mantendo a ..."
Desvendando o Fascinante Mundo dos Slots Online em www.slots light.com,https://acaua.pi.gov.br/legislacaoView/?btid=14915063,"www slots www.slots light.com⭐Descubra a emoção e diversão dos slots online no cativante www.slots light.com. Explore uma variedade de jogos incríveis e experimente a adrenalina de ganhar prêmios emocionantes enquanto se diverte. - PI ... contato@acaua.pi.gov.br (89) 3493-0039; Av. Bonifácio Severo Coelho, 443 - Centro, ..."
jogo fruit slots-www.camaraserrinha.ba.gov.br,https://www.camaraserrinha.ba.gov.br/post/jogo-fruit-slots-2024-03-05-id-24886.html,"🏀jogo fruit slots🏀⚽️【www.camaraserrinha.ba.gov.br】⚽️. Para resumir, no Passeio Completo você precisa usar terno e gravata, enquanto no Esporte Fino está liberado para adotar um 💳 look levemente mais casual, com camisa, calça de alfaiataria e sapato, com algumas variações possíveis."
Lotsa Slots - barradochoca.ba.gov.br,https://www.barradochoca.ba.gov.br/portal/uploads/seletivo/20240106/2121.html,"Lotsa Slots é uma plataforma de caça-níqueis online que oferece uma ampla variedade de jogos envolventes e emocionantes. Com uma interface amigável, gráficos vibrantes e uma seleção diversificada de temas, Lotsa Slots proporciona uma experiência de jogo inigualável para entusiastas de cassinos virtuais."
Slots de Cassino Real Online: Edição do Dragão - barradochoca.ba.gov.br,https://www.barradochoca.ba.gov.br/portal/uploads/seletivo/20240108/1715.html,"Os slots de cassino real online da ""Edição do Dragão"" oferecem uma experiência de jogo emocionante e mágica. Com uma temática envolvente, gráficos deslumbrantes e a chance de ganhar prêmios épicos, esses jogos são uma escolha incrível para os amantes de caça-níqueis. Lembre-se sempre de jogar com responsabilidade e de aproveitar a ..."
PG Soft Demo Slots: Experimente a Emoção Gratuitamente!,https://www.barradochoca.ba.gov.br/portal/uploads/seletivo/20240108/1453.html,"Os PG Soft Demo Slots são uma porta de entrada emocionante para o mundo dos jogos de cassino da PG Soft. Experimente a emoção e a diversão desses jogos sem gastar dinheiro real. Aproveite a oportunidade para aprender, praticar e descobrir novos jogos. Divirta-se jogando os demos e, quando estiver pronto, você pode dar o próximo passo e ..."
BR Slots - Novos Jogadores Ganham R,https://biblioteca.cofen.gov.br/wp-includes/images/crystal/news/20231103/1279.shtml,"BR Slots - Novos Jogadores Ganham R . aposta futebol monte carlosnão era fantasia propriamente, quando ele formulou suas principais teses sobre o passado colonial brasileiro, nos anos 1930 e 40. Lá, tendo por fundo as teses comunistas em ascensão internacional, Caio Se você é um amante de jogos de cassino e adora a emoção dos caça ..."
BR Slots - Novos Jogadores Ganham R,https://biblioteca.cofen.gov.br/wp-includes/images/crystal/news/20231103/1981.shtml,"BR Slots - Novos Jogadores Ganham R . aposta futebol monte carlosnão era fantasia propriamente, quando ele formulou suas principais teses sobre o passado colonial brasileiro, nos anos 1930 e 40. Lá, tendo por fundo as teses comunistas em ascensão internacional, Caio Se você é um amante de jogos de cassino e adora a emoção dos caça ..."
slots ouro - bombeiros.pa.gov.br,https://www.bombeiros.pa.gov.br/play=20240528win85.html,"slots ouro 【BRAGBG.com】 A experiência do usuário sempre foi uma prioridade para a slots ouro. Nós nos esforçamos para oferecer depósitos e saques eficientes e rápidos, visando proporcionar a melhor experiência aos nossos usuários. Investimos na melhoria contínua dos métodos de pagamento e no treinamento da nossa equipe, garantindo uma experiência livre de atrasos e restrições."
bet pt slots-www.camaraserrinha.ba.gov.br,http://www.camaraserrinha.ba.gov.br/news/bet-pt-slots-2024-01-15-id-6689.html,bet pt slots jogar truco apostadobet pt slots betpix365 bônus cadastro betpix365 bônus cadastro em 2024/1/15 21:15:22. compartilhe no facebook! compartilhe no twitter! compartilhar!! incorporar; denunciar abuso; 🏀bet pt slots🏀⚽️【www.camaraserrinha.ba.gov.br ...
alano 3 slots paga - ppi.gov.br,https://www.ppi.gov.br/video/2023-11-02-todos os codigos do blox fruits/,"alano 3 slots paga🎰Brasil x Venezuela: em resposta ao Procon de Cuiabá, CBF revela que ofertou só 10% de meias-entradas***** A CBF respondeu, na segunda-feira, à notificação do Procon Municipal de Cuiabá referente aos ingressos da partida entre Brasil e Venezuela, na quinta-feira, às 21h30 (de Brasília), na Arena Pantanal, pela ..."
Baixar King Slots - Free Slots Casino na Microsoft Store pt-BR,https://www.theobroma.ro.gov.br/v1/trasparencia/article/20240112/5525.html,1. Por que Escolher King Slots - Free Slots Casino. King Slots - Free Slots Casino é muito mais do que apenas um aplicativo de caça-níqueis comum. Aqui estão algumas razões para escolher este emocionante jogo: Experiência Autêntica de Cassino: Desfrute da atmosfera de um cassino real no conforto da sua casa.
Bem Slots: O Cassino de Slots Mais Seguro do Brasil!,https://morrodochapeu.ba.gov.br/portal/covide/article/20240108/753.html,"O Bem Slots é o cassino de caça-níqueis mais seguro do Brasil, oferecendo uma experiência de cassino online emocionante e segura. Com uma variedade de jogos disponíveis, você pode encontrar o que melhor se adapta ao seu gosto e estilo. Lembre-se de jogar com responsabilidade e aproveitar ao máximo sua experiência no Bem Slots."
Baixar BR SLOTS para PC - Desfrute de Caça-Níqueis no Computador,https://morrodochapeu.ba.gov.br/portal/covide/article/20240108/932.html,"O BR SLOTS é um aplicativo de cassino popular que oferece uma ampla variedade de jogos de caça-níqueis. Ele é projetado para proporcionar uma experiência de cassino emocionante e realista no mundo virtual. Com uma seleção diversificada de jogos de alta qualidade, bônus empolgantes e gráficos envolventes, o BR SLOTS se tornou uma ..."
jogos de slots grￃﾡtis⭐Desvende a Magia dos Jogos de Slots Gratuitos ...,https://academiavirtual.inpi.gov.br/moodle/course/view.php?xzid=Desvendando+as+Emoções+e+Estrategias+por+tras+das+Apostas+em+Futebol,"Os jogos de slots gratuitos oferecem uma experiência de jogo emocionante e cativante, repleta de cores vibrantes, gráficos envolventes e uma trilha sonora empolgante A simplicidade das mecânicas de jogo torna-os acessíveis a jogadores de todos os níveis de habilidade, enquanto as diversas temáticas e bônus especiais mantêm a ..."
jogo fruit slots-www.camaraserrinha.ba.gov.br,https://www.camaraserrinha.ba.gov.br/app/jogo-fruit-slots-2024-01-11-id-24886.html,jogo fruit slots casino online bonus de registojogo fruit slots como realizar saque na bet365 como realizar saque na bet365 em 2024/3/7 16:06:15. compartilhe no facebook! compartilhe no twitter! compartilhar!! incorporar; denunciar abuso; 🏀jogo fruit slots🏀⚽️【www.camaraserrinha.ba.gov.br ...
bigwin slots - itapema.sc.gov.br,https://www.itapema.sc.gov.br/sistemas/news/20240208/160.html,"bigwin slots . Se você é apaixonado por caça-níqueis online, prepare-se para embarcar em uma jornada emocionante com BigWin Slots. Neste guia abrangente, vamos explorar a incrível variedade de jogos, recursos exclusivos e dicas para maximizar sua experiência com os slots da BigWin. **Variedade de Jogos de Caça-Níqueis**"
BR Slots - Novos Jogadores Ganham R - theobroma.ro.gov.br,https://www.theobroma.ro.gov.br/v1/trasparencia/article/20240131/4158.html,"BR Slots - Novos Jogadores Ganham R . Se você é um amante de jogos de cassino e adora a emoção dos caça-níqueis, não pode perder a oportunidade de experimentar o BR Slots. Além de uma ampla seleção de jogos de caça-níqueis emocionantes, este cassino online oferece um bônus especial de boas-vindas de R$ 8,00 para novos jogadores. ..."
robo slots - transparencia.valereal.rs.gov.br:8083,http://www.transparencia.valereal.rs.gov.br:8083/?video=ojogodobicho-deunoposte.shtml,"robo slots⚡️Inscreva-se agora e reivindique seu bônus⚡️ Casal de ciclistas de Mogi das Cruzes vive a expectativa pela participação no L'Étape na França***** Casal de ciclistas de Mogi vive a expectativa pela participação de prova na França , Marido e mulher na vida e parceiros de pedal. É desta forma que os ciclistas Felipe ..."
Baixar MyJackpot - Slots & Casino na Microsoft Store pt-BR,https://www.barradochoca.ba.gov.br/portal/uploads/seletivo/20240108/662.html,"O MyJackpot - Slots & Casino é uma escolha fantástica para entusiastas de cassinos que desejam experimentar a emoção dos jogos de caça-níqueis e dos cassinos no mundo virtual. Baixar o aplicativo na Microsoft Store pt-BR é fácil e seguro, permitindo que você acesse uma ampla variedade de jogos e aproveite todos os benefícios ..."
frutabet login - bombeiros.pa.gov.br,https://www.bombeiros.pa.gov.br/blank=20240529etihad stadium.html,"Os jogadores agora têm mais opções do que nunca para desfrutar de jogos de alta qualidade, seguros e emocionantes. Não perca tempo e junte-se à frutabet login Slots hoje mesmo para aproveitar todos esses benefícios incríveis. A sorte está ao seu lado! Detalhes. Tamanho: 23.9 MB Idioma: chinês simplificado. Categoria: Outro Sistema ..."
jogar slots gratis - bombeiros.pa.gov.br,https://www.bombeiros.pa.gov.br/blank=20240524loterias menu.html,"jogar slots gratis oferece benefícios exclusivos para jogadores online. A popular plataforma de apostas online, jogar slots gratis, acaba de lançar uma novidade emocionante: a introdução de uma vasta seleção de slots online. Com essa nova adição, os jogadores terão acesso a uma experiência de jogo inigualável, repleta de benefícios ..."
blaze melhores slots-www.camaraserrinha.ba.gov.br,http://www.camaraserrinha.ba.gov.br/post/blaze-melhores-slots-2024-03-11-id-13879.html,blaze melhores slots login 1xbet zambiablaze melhores slots jogos yiv jogos yiv em 2024/3/11 17:25:16. compartilhe no facebook! compartilhe no twitter! compartilhar!! incorporar; denunciar abuso; 🏀blaze melhores slots🏀⚽️【www.camaraserrinha.ba.gov.br ...
BR Slots - Novos Jogadores Ganham R - theobroma.ro.gov.br,https://www.theobroma.ro.gov.br/v1/trasparencia/article/20240115/2376.html,"O BR Slots é conhecido por proporcionar uma experiência de cassino emocionante e divertida. Aqui estão algumas razões pelas quais você deve considerar jogar no BR Slots: Variedade de Jogos: O BR Slots oferece uma vasta gama de jogos de caça-níqueis com temas diversos. Você pode encontrar jogos clássicos, caça-níqueis de vídeo e até ..."
Baixar King Slots - Free Slots Casino na Microsoft Store pt-BR,https://www.itapema.sc.gov.br/sistemas/news/20240207/36.html,"Baixar King Slots - Free Slots Casino na Microsoft Store pt-BRapostar no 365bet.bet é comprovadamente seguro. O site conta com certificações de segurança, o que garante tranquilidade aos usuários no que diz respeito à proteção dos dados e também sobre as transações financeiras, como saques e depósitos de valores."
Play Online Slots BR - morrodochapeu.ba.gov.br,https://morrodochapeu.ba.gov.br/portal/covide/article/20240107/2547.html,"Como Play Online Slots BR,⭐️100% bonus for the first deposit ⭐️ Inscreva-se agora e reivindique seu bônus ⭐️ Best odds ⭐️ Reputation is an old platform. ⭐️ Full range of colors and legal licenses ⭐️ Online casino games."
Play Online Slots BR - morrodochapeu.ba.gov.br,https://morrodochapeu.ba.gov.br/portal/covide/article/20240107/1001.html,"Play Online Slots BR. beto carrero ingresso. bet pix 365 bônus. Play Online Slots BR LIVE Os caça-níqueis online se tornaram uma forma popular de entretenimento no Brasil, proporcionando uma experiência emocionante e conveniente para os entusiastas de jogos de azar. Neste guia abrangente, vamos explorar como jogar caça-níqueis online no ..."
BR SLOTS APK (Android Game) - Baixar Grátis,https://www.sombrio.sc.gov.br/wp-content/smush-webp/2022/02/27/1702.html,"O BR SLOTS é um aplicativo de cassino para dispositivos Android que oferece uma ampla variedade de jogos de slot. Este APK permite que você desfrute da emoção de um cassino diretamente na palma da sua mão. Com uma interface amigável e uma seleção diversificada de jogos, o BR SLOTS é uma ótima opção para quem gosta de caça-níqueis. ..."
Obtendo o The Four Kings Casino and Slots - theobroma.ro.gov.br,https://www.theobroma.ro.gov.br/v1/trasparencia/article/20240118/2430.html,"O The Four Kings Casino and Slots é uma experiência única que combina a emoção de um cassino virtual com a conveniência de jogar online. Se você está pronto para mergulhar neste mundo exclusivo de entretenimento, este guia irá mostrar como obter o jogo e aproveitar ao máximo cada momento. Obtendo o The Four Kings Casino and Slots."
slots ganhar dinheiro⭐Descubra os segredos para ganhar grandes fortunas ...,http://procon.pa.gov.br/?q=video/A+Revolução+do+Entretenimento+Online:+Explorando+o+Mundo+Fascinante+do+Esporte+Betty+-+Kfbet,"27/05/2024. Explore estratégias inteligentes e dicas valiosas para maximizar seus ganhos e se tornar um mestre das slots de cassino. Imagine-se imerso em um mundo de luzes brilhantes, sons eletrizantes e a promessa de fortunas instantâneas - bem-vindo às máquinas caça-níqueis!"
Bem Slots: O Cassino de Slots Mais Seguro do Brasil!,https://www.barradochoca.ba.gov.br/portal/uploads/seletivo/20240108/3292.html,"O Bem Slots é o cassino de caça-níqueis mais seguro do Brasil, oferecendo uma experiência de cassino online emocionante e segura. Com uma variedade de jogos disponíveis, você pode encontrar o que melhor se adapta ao seu gosto e estilo. Lembre-se de jogar com responsabilidade e aproveitar ao máximo sua experiência no Bem Slots."
Slots Casino - barradochoca.ba.gov.br,https://www.barradochoca.ba.gov.br/portal/uploads/seletivo/20240108/1411.html,"O ""Slots Casino™ - Fortune King"" na App Store é a sua passagem para o mundo emocionante dos caça-níqueis e recompensas incríveis. Com uma seleção diversificada de jogos, bônus generosos e uma comunidade vibrante de jogadores, você está prestes a embarcar em uma jornada de entretenimento e oportunidades de vitória. Lembre-se de jogar ..."
Play Online Slots BR - itapema.sc.gov.br,https://www.itapema.sc.gov.br/sistemas/news/20240206/3363.html,"Play Online Slots BR . Os caça-níqueis online se tornaram uma forma popular de entretenimento no Brasil, proporcionando uma experiência emocionante e conveniente para os entusiastas de jogos de azar. Neste guia abrangente, vamos explorar como jogar caça-níqueis online no Brasil, destacando as vantagens, oferecendo dicas para maximizar a ..."
